Order ID,Product Name,Discount,Sales,Quantity,Category
ES-2014-5666077,"Samsung Signal Booster, Full Size",0.1,248.00,2,Technology
ES-2014-5917022,"Hamilton Beach Toaster, Silver",0.1,157.00,3,Office Supplies
ES-2014-5917022,"Sharp Ink, Laser",0.15,529.00,5,Technology
ES-2014-5917022,"Samsung Speaker Phone, Cordless",0.15,429.00,4,Technology
IT-2014-2273520,"Wilson Jones Binder Covers, Economy",0.5,6.00,1,Office Supplies
ES-2014-4940256,"Rogers File Cart, Single Width",0.5,283.00,4,Office Supplies
ES-2014-5528295,"Dania Corner Shelving, Traditional",0,244.00,2,Furniture
ES-2014-4143720,"Ibico Binding Machine, Recycled",0,207.00,4,Office Supplies
ES-2014-4245910,"Hon Rocking Chair, Black",0.1,346.00,3,Furniture
ES-2014-4245910,"Cardinal Hole Reinforcements, Recycled",0,17.00,3,Office Supplies
ES-2014-4035543,"Sanford Pencil Sharpener, Water Color",0,104.00,4,Office Supplies
ES-2014-3701138,"Cardinal 3-Hole Punch, Clear",0,113.00,4,Office Supplies
IT-2014-5935536,"Epson Calculator, Durable",0.5,47.00,2,Technology
ES-2014-5488768,"Office Star Rocking Chair, Set of Two",0,429.00,3,Furniture
ES-2014-5488768,"Acco Binder Covers, Recycled",0,82.00,6,Office Supplies
ES-2014-5488768,"Avery Binder Covers, Recycled",0,23.00,2,Office Supplies
ES-2014-5951204,"Advantus Clamps, Assorted Sizes",0,67.00,4,Office Supplies
ES-2014-4913372,"Smead Folders, Wire Frame",0,33.00,2,Office Supplies
ES-2014-1311038,"Avery Legal Exhibit Labels, 5000 Label Set",0,35.00,3,Office Supplies
ES-2014-1311038,"Fellowes Folders, Blue",0,79.00,3,Office Supplies
ES-2014-1311038,"Fellowes Folders, Wire Frame",0,51.00,2,Office Supplies
ES-2014-1311038,"Rogers Shelving, Wire Frame",0,122.00,2,Office Supplies
ES-2014-3754715,"Sanford Pens, Fluorescent",0,87.00,7,Office Supplies
ES-2014-3754715,"Accos Paper Clips, Assorted Sizes",0,14.00,1,Office Supplies
ES-2014-1311038,"Memorex Memory Card, USB",0,307.00,3,Technology
ES-2014-1311038,"SanDisk Numeric Keypad, Bluetooth",0,389.00,7,Technology
ES-2014-1311038,"Apple Signal Booster, Full Size",0,414.00,3,Technology
ES-2014-3754715,"Epson Receipt Printer, White",0.1,312.00,3,Technology
IT-2014-1559800,"Fellowes Shelving, Industrial",0,175.00,3,Office Supplies
IT-2014-3150765,"Sauder Classic Bookcase, Metal",0.5,2830.00,13,Furniture
IT-2014-3150765,"Sanford Sketch Pad, Fluorescent",0.5,47.00,2,Office Supplies
IT-2014-3150765,"Stanley Markers, Water Color",0.5,38.00,3,Office Supplies
IT-2014-3150765,"Acco 3-Hole Punch, Recycled",0.5,61.00,4,Office Supplies
IT-2014-3150765,"Fellowes File Cart, Wire Frame",0.5,205.00,3,Office Supplies
IT-2014-3150765,"Tenex Folders, Single Width",0.5,47.00,4,Office Supplies
ES-2014-1107818,"Hamilton Beach Blender, Black",0,282.00,4,Office Supplies
ES-2014-1107818,"Hoover Stove, Red",0,1137.00,2,Office Supplies
ES-2014-1016124,"Cardinal Binder, Durable",0,31.00,2,Office Supplies
ES-2014-2995872,"Fellowes Folders, Single Width",0,79.00,3,Office Supplies
ES-2014-3653593,"Harbour Creations Bag Chairs, Set of Two",0.5,32.00,1,Furniture
ES-2014-3653593,"Deflect-O Clock, Black",0.6,161.00,8,Furniture
ES-2014-3653593,"Green Bar Parchment Paper, Recycled",0.5,50.00,6,Office Supplies
ES-2014-4995013,"Stanley Markers, Water Color",0,152.00,6,Office Supplies
ES-2014-4995013,"Ames Clasp Envelope, Recycled",0,6.00,1,Office Supplies
ES-2014-4995013,"OIC Push Pins, Bulk Pack",0,45.00,3,Office Supplies
ES-2014-4995013,"Fellowes Trays, Single Width",0.1,103.00,2,Office Supplies
ES-2014-4995013,"Elite Box Cutter, High Speed",0,140.00,4,Office Supplies
ES-2014-4995013,"Logitech Mouse, USB",0,88.00,3,Technology
ES-2014-4995013,"Apple Audio Dock, with Caller ID",0.1,451.00,3,Technology
IT-2014-4445923,"Epson Phone, Durable",0.15,482.00,7,Technology
ES-2014-1848240,"Fellowes File Cart, Blue",0,412.00,3,Office Supplies
IT-2014-2449347,"Binney & Smith Sketch Pad, Easy-Erase",0.5,93.00,4,Office Supplies
IT-2014-2449347,"Harbour Creations Color Coded Labels, Alphabetical",0.5,19.00,3,Office Supplies
IT-2014-2449347,"Novimex Round Labels, Alphabetical",0.5,9.00,3,Office Supplies
IT-2014-2449347,"Smead File Cart, Blue",0.5,319.00,5,Office Supplies
ES-2014-1848240,"Panasonic Card Printer, Wireless",0,174.00,1,Technology
IT-2014-2449347,"Canon Copy Machine, Laser",0.5,262.00,2,Technology
ES-2014-4472745,"Advantus Photo Frame, Black",0,689.00,13,Furniture
ES-2014-4472745,"Cuisinart Refrigerator, Black",0,2478.00,5,Office Supplies
ES-2014-4369466,"Apple Headset, Full Size",0,671.00,9,Technology
IT-2014-4920177,"Rogers Lockers, Wire Frame",0.5,211.00,2,Office Supplies
ES-2014-5081971,"Okidata Receipt Printer, Durable",0,369.00,3,Technology
ES-2014-3221372,"Enermax Keyboard, USB",0,335.00,4,Technology
ES-2014-3185757,"Cuisinart Coffee Grinder, Silver",0.1,106.00,3,Office Supplies
ES-2014-3185757,"Okidata Printer, Durable",0,269.00,1,Technology
ES-2014-2829389,"Sanford Markers, Water Color",0,79.00,3,Office Supplies
ES-2014-5205657,"Ikea Classic Bookcase, Traditional",0,1235.00,3,Furniture
ES-2014-5205657,"SanDisk Message Books, 8.5 x 11",0,56.00,2,Office Supplies
ES-2014-5205657,"Smead Shelving, Wire Frame",0.4,29.00,1,Office Supplies
ES-2014-5205657,"Okidata Phone, White",0.4,102.00,2,Technology
ES-2014-3967982,"Tenex Stacking Tray, Black",0,126.00,5,Furniture
ES-2014-3967982,"Avery Color Coded Labels, Alphabetical",0,39.00,3,Office Supplies
ES-2014-3967982,"Harbour Creations Shipping Labels, 5000 Label Set",0,36.00,3,Office Supplies
ES-2014-3967982,"Elite Letter Opener, High Speed",0,107.00,4,Office Supplies
ES-2014-4297152,"Ikea Corner Shelving, Pine",0.1,448.00,4,Furniture
ES-2014-4297152,"Boston Highlighters, Water Color",0,44.00,2,Office Supplies
ES-2014-4297152,"Tenex Lockers, Wire Frame",0.1,1280.00,7,Office Supplies
IT-2014-4432677,"SAFCO Swivel Stool, Black",0.5,248.00,3,Furniture
IT-2014-5261263,"Ames Peel and Seal, Security-Tint",0.5,63.00,6,Office Supplies
ES-2014-5041758,"Stanley Pens, Fluorescent",0,90.00,8,Office Supplies
IT-2014-5928156,"Ibico Index Tab, Clear",0.5,8.00,2,Office Supplies
IT-2014-5928156,"HP Copy Machine, Color",0.5,735.00,6,Technology
ES-2014-1656071,"Konica Printer, Durable",0,1072.00,4,Technology
ES-2014-4329629,"Stanley Markers, Easy-Erase",0,45.00,2,Office Supplies
ES-2014-4329629,"Eldon Trays, Blue",0.1,86.00,2,Office Supplies
ES-2014-3404737,"Avery Binder Covers, Durable",0,38.00,3,Office Supplies
ES-2014-3404737,"Stiletto Letter Opener, High Speed",0,111.00,4,Office Supplies
ES-2014-4329629,"Cisco Office Telephone, with Caller ID",0.15,274.00,4,Technology
ES-2014-4229063,"Novimex Steel Folding Chair, Black",0.1,575.00,8,Furniture
ES-2014-2623115,"Deflect-O Clock, Ergonomic",0,343.00,7,Furniture
IT-2014-4774804,"Elite Letter Opener, Easy Grip",0.5,27.00,2,Office Supplies
ES-2014-2623115,"BIC Highlighters, Easy-Erase",0,38.00,2,Office Supplies
ES-2014-2623115,"Canon Fax and Copier, Laser",0,574.00,3,Technology
ES-2014-5326009,"Boston Pens, Blue",0,85.00,6,Office Supplies
ES-2014-5326009,"Harbour Creations File Folder Labels, 5000 Label Set",0,27.00,3,Office Supplies
ES-2014-3070667,"Memorex Flash Drive, Ergonomic",0,82.00,3,Technology
IT-2014-5410813,"StarTech Inkjet, Wireless",0.4,724.00,4,Technology
IT-2014-5190106,"Jiffy Business Envelopes, Recycled",0,44.00,3,Office Supplies
IT-2014-5190106,"Rogers Shelving, Blue",0.1,168.00,3,Office Supplies
IT-2014-5190106,"Enermax Mouse, Ergonomic",0,114.00,3,Technology
IT-2014-5190106,"Brother Fax and Copier, Digital",0.15,1300.00,8,Technology
ES-2014-1526550,"GlobeWeis Manila Envelope, Set of 50",0,55.00,2,Office Supplies
ES-2014-2363123,"BIC Highlighters, Blue",0,95.00,5,Office Supplies
ES-2014-3850519,"Fellowes Box, Wire Frame",0.4,113.00,10,Office Supplies
ES-2014-5749799,"Office Star Steel Folding Chair, Adjustable",0,471.00,5,Furniture
ES-2014-5749799,"Avery Hole Reinforcements, Durable",0,18.00,3,Office Supplies
ES-2014-5749799,"Advantus Staples, Assorted Sizes",0,17.00,2,Office Supplies
ES-2014-5749799,"Enermax Flash Drive, USB",0,83.00,2,Technology
IT-2014-3393466,"Acme Shears, Easy Grip",0.5,129.00,5,Office Supplies
ES-2014-4978946,"Cisco Headset, with Caller ID",0.1,637.00,8,Technology
IT-2014-4809782,"Harbour Creations Chairmat, Adjustable",0.1,134.00,2,Furniture
IT-2014-4809782,"Tenex Stacking Tray, Black",0,51.00,2,Furniture
IT-2014-2988943,"Harbour Creations Rocking Chair, Set of Two",0.5,224.00,3,Furniture
IT-2014-4809782,"Motorola Audio Dock, Cordless",0,529.00,3,Technology
IT-2014-5284970,"Okidata Printer, Durable",0.5,269.00,2,Technology
ES-2014-5272129,"Sanford Sketch Pad, Fluorescent",0,234.00,5,Office Supplies
ES-2014-5272129,"Samsung Audio Dock, Full Size",0,672.00,4,Technology
ES-2014-1178010,"Okidata Receipt Printer, Red",0.15,918.00,9,Technology
ES-2014-1833179,"Boston Highlighters, Blue",0,94.00,5,Office Supplies
ES-2014-1833179,"GlobeWeis Business Envelopes, Recycled",0,65.00,4,Office Supplies
ES-2014-5662666,"BIC Highlighters, Easy-Erase",0,38.00,2,Office Supplies
ES-2014-2739856,"Eldon Shelving, Single Width",0,145.00,3,Office Supplies
IT-2014-5613283,"Sanford Sketch Pad, Fluorescent",0.5,47.00,2,Office Supplies
IT-2014-5268305,"Canon Fax Machine, High-Speed",0.65,332.00,3,Technology
ES-2014-2457136,"Avery Round Labels, Adjustable",0,5.00,1,Office Supplies
ES-2014-4089082,"Hoover Stove, White",0,1700.00,3,Office Supplies
ES-2014-4089082,"Belkin Mouse, Ergonomic",0,154.00,4,Technology
ES-2014-4089082,"SanDisk Numeric Keypad, Ergonomic",0,455.00,8,Technology
ES-2014-5298444,"Canon Wireless Fax, Laser",0,757.00,2,Technology
ES-2014-2398483,"Accos Paper Clips, Bulk Pack",0,57.00,4,Office Supplies
ES-2014-5252744,"Ibico Binding Machine, Economy",0.1,93.00,2,Office Supplies
ES-2014-5252744,"OIC Staples, Metal",0.1,52.00,5,Office Supplies
ES-2014-2280822,"Jiffy Business Envelopes, Security-Tint",0,32.00,2,Office Supplies
ES-2014-2280822,"Enermax Parchment Paper, Multicolor",0,34.00,2,Office Supplies
ES-2014-2280822,"Fellowes Folders, Industrial",0,81.00,3,Office Supplies
ES-2014-2280822,"Rogers Shelving, Wire Frame",0,184.00,3,Office Supplies
ES-2014-2280822,"Tenex Trays, Blue",0,271.00,5,Office Supplies
ES-2014-2280822,"Kleencut Scissors, Serrated",0,57.00,3,Office Supplies
ES-2014-1082027,"BIC Pens, Easy-Erase",0,44.00,3,Office Supplies
ES-2014-1082027,"Green Bar Computer Printout Paper, Recycled",0,59.00,2,Office Supplies
ES-2014-2557751,"Stockwell Rubber Bands, Assorted Sizes",0,42.00,3,Office Supplies
ES-2014-2557751,"Rogers Box, Industrial",0.1,110.00,5,Office Supplies
ES-2014-2557751,"Panasonic Calculator, Red",0,332.00,7,Technology
ES-2014-2546078,"Hon Shipping Labels, Alphabetical",0,11.00,1,Office Supplies
ES-2014-2546078,"SanDisk Numeric Keypad, Bluetooth",0,221.00,4,Technology
ES-2014-5464390,"Acco Binder Covers, Clear",0,64.00,5,Office Supplies
ES-2014-3288313,"Fiskars Trimmer, Steel",0,125.00,3,Office Supplies
ES-2014-2387068,"Ibico Binder Covers, Clear",0,39.00,3,Office Supplies
ES-2014-2387068,"Wilson Jones 3-Hole Punch, Recycled",0,85.00,3,Office Supplies
ES-2014-3512694,"Konica Receipt Printer, White",0.1,109.00,1,Technology
ES-2014-5583177,"Hoover Toaster, White",0,164.00,2,Office Supplies
ES-2014-5583177,"Cardinal Index Tab, Durable",0,38.00,5,Office Supplies
ES-2014-4210004,"Boston Sketch Pad, Water Color",0,155.00,3,Office Supplies
ES-2014-1325616,"Hewlett Copy Machine, Color",0,1060.00,4,Technology
ES-2014-1325616,"Motorola Speaker Phone, Cordless",0,265.00,2,Technology
ES-2014-1876230,"Cuisinart Toaster, Silver",0.5,81.00,3,Office Supplies
ES-2014-2097725,"Sanford Sketch Pad, Blue",0,273.00,6,Office Supplies
ES-2014-1876230,"Motorola Signal Booster, Cordless",0.5,657.00,9,Technology
ES-2014-4478437,"Stanley Canvas, Fluorescent",0,355.00,7,Office Supplies
ES-2014-4478437,"Kraft Peel and Seal, Set of 50",0,61.00,3,Office Supplies
ES-2014-4478437,"Tenex Shelving, Industrial",0.1,149.00,3,Office Supplies
ES-2014-4478437,"Enermax Memory Card, USB",0,688.00,6,Technology
ES-2014-4588874,"Cardinal Binding Machine, Economy",0,348.00,7,Office Supplies
ES-2014-4588874,"SanDisk Parchment Paper, 8.5 x 11",0,146.00,7,Office Supplies
ES-2014-1150703,"Boston Highlighters, Water Color",0,110.00,5,Office Supplies
ES-2014-1150703,"Jiffy Manila Envelope, Set of 50",0,156.00,6,Office Supplies
ES-2014-1150703,"Motorola Audio Dock, Cordless",0,529.00,3,Technology
IT-2014-1201093,"Panasonic Calculator, White",0.4,263.00,9,Technology
ES-2014-3941562,"BIC Pencil Sharpener, Easy-Erase",0.5,44.00,3,Office Supplies
ES-2014-3941562,"Binney & Smith Sketch Pad, Water Color",0.5,50.00,2,Office Supplies
ES-2014-3941562,"Boston Markers, Blue",0.5,13.00,1,Office Supplies
ES-2014-3941562,"Konica Receipt Printer, White",0.5,241.00,4,Technology
ES-2014-1345837,"Hon Removable Labels, Laser Printer Compatible",0,40.00,4,Office Supplies
ES-2014-1345837,"Xerox Memo Slips, Premium",0,27.00,2,Office Supplies
ES-2014-3848533,"Cuisinart Stove, Silver",0,1078.00,2,Office Supplies
ES-2014-3848533,"HP Ink, Digital",0,385.00,3,Technology
ES-2014-3421274,"Kleencut Ruler, High Speed",0,54.00,4,Office Supplies
ES-2014-5119286,"Green Bar Parchment Paper, Multicolor",0,18.00,1,Office Supplies
ES-2014-2397033,"Stanley Canvas, Fluorescent",0,101.00,2,Office Supplies
ES-2014-2397033,"HP Wireless Fax, Digital",0,360.00,1,Technology
IT-2014-3675672,"Smead Legal Exhibit Labels, Adjustable",0,27.00,3,Office Supplies
IT-2014-3675672,"Tenex Shelving, Blue",0.1,98.00,2,Office Supplies
IT-2014-2181834,"Harbour Creations Steel Folding Chair, Black",0.5,239.00,5,Furniture
IT-2014-5162314,"HP Fax Machine, Laser",0.5,450.00,3,Technology
ES-2014-2899641,"Harbour Creations Swivel Stool, Adjustable",0,548.00,3,Furniture
ES-2014-3432314,"Advantus Stacking Tray, Durable",0,211.00,8,Furniture
IT-2014-2122888,"Novimex Steel Folding Chair, Red",0.5,41.00,1,Furniture
IT-2014-2122888,"Advantus Door Stop, Duo Pack",0.2,216.00,6,Furniture
IT-2014-2122888,"Rubbermaid Frame, Duo Pack",0.2,616.00,7,Furniture
IT-2014-2122888,"Advantus Clamps, Metal",0.5,10.00,1,Office Supplies
IT-2014-2122888,"Harbour Creations Color Coded Labels, Alphabetical",0.5,25.00,4,Office Supplies
IT-2014-2122888,"Xerox Computer Printout Paper, Recycled",0.5,53.00,4,Office Supplies
IT-2014-2122888,"Xerox Note Cards, Recycled",0.5,13.00,1,Office Supplies
IT-2014-4194003,"Smead Trays, Single Width",0.4,58.00,2,Office Supplies
ES-2014-2301611,"Fellowes File Cart, Wire Frame",0.1,245.00,2,Office Supplies
ES-2014-1179960,"Hoover Blender, White",0,685.00,7,Office Supplies
ES-2014-1179960,"Epson Card Printer, Durable",0,850.00,5,Technology
ES-2014-1480923,"Stockwell Paper Clips, Assorted Sizes",0,57.00,5,Office Supplies
ES-2014-1480923,"Konica Phone, Red",0.4,200.00,4,Technology
ES-2014-5123839,"Rogers Shelving, Industrial",0,250.00,4,Office Supplies
IT-2014-4642454,"Harbour Creations Removable Labels, Adjustable",0,41.00,5,Office Supplies
IT-2014-4642454,"Smead File Cart, Blue",0.1,344.00,3,Office Supplies
IT-2014-4642454,"HP Ink, Laser",0,1030.00,8,Technology
ES-2014-1308719,"SanDisk Keyboard, Programmable",0,166.00,2,Technology
IT-2014-1082723,"Canon Personal Copier, Laser",0,856.00,6,Technology
IT-2014-1082723,"Okidata Receipt Printer, White",0,485.00,4,Technology
ES-2014-5347900,"Stanley Markers, Easy-Erase",0.5,67.00,6,Office Supplies
ES-2014-4393845,"Cameo Business Envelopes, Set of 50",0,82.00,4,Office Supplies
IT-2014-4499061,"Jiffy Business Envelopes, Set of 50",0,117.00,6,Office Supplies
IT-2014-4499061,"Canon Fax Machine, High-Speed",0.15,1076.00,4,Technology
IT-2014-4499061,"Sharp Fax Machine, Digital",0.15,1506.00,6,Technology
ES-2014-5801819,"Boston Highlighters, Water Color",0,110.00,5,Office Supplies
ES-2014-5801819,"Eaton Memo Slips, 8.5 x 11",0,54.00,3,Office Supplies
ES-2014-2424949,"Rogers Folders, Industrial",0,62.00,2,Office Supplies
ES-2014-1364039,"Advantus Clock, Durable",0,242.00,5,Furniture
IT-2014-1075109,"Tenex Folders, Industrial",0.1,85.00,4,Office Supplies
ES-2014-2631855,"Binney & Smith Markers, Fluorescent",0,51.00,2,Office Supplies
ES-2014-2631855,"Stanley Pens, Easy-Erase",0,31.00,3,Office Supplies
ES-2014-2631855,"Kraft Mailers, Security-Tint",0,240.00,6,Office Supplies
ES-2014-2631855,"Kleencut Trimmer, Steel",0,163.00,4,Office Supplies
ES-2014-2443168,"Binney & Smith Highlighters, Water Color",0,40.00,2,Office Supplies
ES-2014-2443168,"Eldon Shelving, Industrial",0.1,132.00,3,Office Supplies
ES-2014-4613373,"Boston Sketch Pad, Fluorescent",0,199.00,4,Office Supplies
ES-2014-4613373,"Fellowes Box, Blue",0.1,89.00,5,Office Supplies
ES-2014-2718788,"Epson Phone, White",0.15,135.00,2,Technology
ES-2014-4967939,"Deflect-O Light Bulb, Ergonomic",0,35.00,2,Furniture
ES-2014-5727003,"Office Star Executive Leather Armchair, Adjustable",0.1,2093.00,5,Furniture
ES-2014-5830221,"Ames Peel and Seal, Security-Tint",0,105.00,5,Office Supplies
ES-2014-3810974,"Stiletto Shears, High Speed",0,240.00,5,Office Supplies
IT-2014-2973778,"Stanley Pencil Sharpener, Water Color",0.5,28.00,2,Office Supplies
IT-2014-2973778,"Tenex Lockers, Industrial",0.5,512.00,5,Office Supplies
ES-2014-4618917,"Wilson Jones Hole Reinforcements, Clear",0,36.00,9,Office Supplies
ES-2014-4934407,"SAFCO Swivel Stool, Set of Two",0,511.00,3,Furniture
ES-2014-4934407,"Binney & Smith Sketch Pad, Blue",0,185.00,4,Office Supplies
ES-2014-4934407,"Smead File Cart, Blue",0,765.00,6,Office Supplies
ES-2014-3206195,"Bush Classic Bookcase, Metal",0,2061.00,5,Furniture
ES-2014-3206195,"BIC Pencil Sharpener, Fluorescent",0,121.00,4,Office Supplies
ES-2014-3206195,"Binney & Smith Pencil Sharpener, Fluorescent",0,80.00,3,Office Supplies
ES-2014-3206195,"Binney & Smith Pencil Sharpener, Water Color",0,189.00,7,Office Supplies
ES-2014-3206195,"Stanley Pencil Sharpener, Water Color",0,100.00,4,Office Supplies
ES-2014-3206195,"Acco Binder, Durable",0,17.00,1,Office Supplies
ES-2014-3206195,"Stockwell Staples, Metal",0,22.00,2,Office Supplies
IT-2014-1448315,"Hamilton Beach Blender, Black",0.1,187.00,3,Office Supplies
ES-2014-3097580,"Cardinal Index Tab, Durable",0,30.00,4,Office Supplies
ES-2014-3097580,"Eldon Shelving, Industrial",0.1,44.00,1,Office Supplies
ES-2014-3491817,"Brother Ink, Laser",0,737.00,5,Technology
ES-2014-3573530,"Binney & Smith Pens, Blue",0,36.00,3,Office Supplies
ES-2014-3091695,"Eaton Memo Slips, Premium",0.1,62.00,5,Office Supplies
IT-2014-1914249,"Smead File Cart, Blue",0.4,76.00,1,Office Supplies
ES-2014-3426802,"Fellowes Folders, Single Width",0,291.00,11,Office Supplies
ES-2014-4682575,"Avery Binder, Recycled",0,27.00,2,Office Supplies
ES-2014-4682575,"Hon Shipping Labels, Laser Printer Compatible",0,11.00,1,Office Supplies
ES-2014-3426802,"Motorola Audio Dock, VoIP",0,520.00,3,Technology
ES-2014-4682575,"Brother Ink, Color",0,297.00,2,Technology
ES-2014-3472643,"Tenex File Cart, Industrial",0.1,845.00,7,Office Supplies
IT-2014-5701429,"Smead File Cart, Single Width",0.5,193.00,3,Office Supplies
ES-2014-1872015,"Binney & Smith Highlighters, Easy-Erase",0,34.00,2,Office Supplies
ES-2014-3248216,"Rogers Box, Single Width",0.1,43.00,2,Office Supplies
ES-2014-3878729,"Boston Markers, Blue",0,79.00,3,Office Supplies
ES-2014-3878729,"Avery Binder, Economy",0,77.00,6,Office Supplies
ES-2014-3878729,"Rogers File Cart, Industrial",0.1,382.00,3,Office Supplies
ES-2014-3878729,"Enermax Numeric Keypad, Bluetooth",0,115.00,2,Technology
ES-2014-3900205,"BIC Highlighters, Fluorescent",0.5,40.00,4,Office Supplies
ES-2014-3900205,"Samsung Office Telephone, Full Size",0.5,166.00,5,Technology
ES-2014-4064307,"Okidata Printer, White",0,2135.00,8,Technology
ES-2014-3223979,"Dania 3-Shelf Cabinet, Pine",0.1,1157.00,9,Furniture
ES-2014-3223979,"Acco Binding Machine, Durable",0,105.00,2,Office Supplies
ES-2014-3223979,"Tenex File Cart, Blue",0.1,360.00,3,Office Supplies
IT-2014-2321796,"Smead Shelving, Wire Frame",0.5,72.00,3,Office Supplies
ES-2014-3223979,"Apple Speaker Phone, Cordless",0,252.00,2,Technology
IT-2014-5571171,"Safco 3-Shelf Cabinet, Metal",0.5,168.00,2,Furniture
ES-2014-5842530,"Bush Library with Doors, Metal",0.1,2292.00,7,Furniture
IT-2014-5571171,"Ibico Hole Reinforcements, Clear",0.5,23.00,7,Office Supplies
IT-2014-1138719,"Smead File Cart, Single Width",0.1,116.00,1,Office Supplies
ES-2014-3604759,"Konica Inkjet, Wireless",0.15,1599.00,6,Technology
ES-2014-1681793,"Fellowes Trays, Wire Frame",0,113.00,2,Office Supplies
ES-2014-3147119,"Green Bar Cards & Envelopes, Recycled",0,97.00,2,Office Supplies
ES-2014-3147119,"Rogers Lockers, Single Width",0.1,381.00,2,Office Supplies
IT-2014-5603908,"GlobeWeis Peel and Seal, with clear poly window",0.5,62.00,5,Office Supplies
IT-2014-3172570,"Fellowes Box, Industrial",0.1,54.00,3,Office Supplies
ES-2014-3014144,"SanDisk Message Books, Premium",0,71.00,3,Office Supplies
ES-2014-3014144,"Fellowes Folders, Wire Frame",0.1,46.00,2,Office Supplies
ES-2014-3014144,"Rogers Folders, Blue",0.1,110.00,4,Office Supplies
ES-2014-3014144,"Brother Fax and Copier, Color",0.15,328.00,2,Technology
ES-2014-2624465,"Bush Floating Shelf Set, Pine",0.1,311.00,2,Furniture
ES-2014-2624465,"BIC Highlighters, Water Color",0,22.00,1,Office Supplies
ES-2014-2624465,"Acco Binding Machine, Recycled",0,206.00,4,Office Supplies
ES-2014-2624465,"Stockwell Push Pins, Assorted Sizes",0,57.00,5,Office Supplies
ES-2014-1726240,"Binney & Smith Canvas, Water Color",0,218.00,4,Office Supplies
ES-2014-1726240,"Wilson Jones Index Tab, Recycled",0,14.00,2,Office Supplies
ES-2014-1726240,"Accos Staples, Metal",0,33.00,3,Office Supplies
ES-2014-1726240,"Novimex Round Labels, Adjustable",0,8.00,2,Office Supplies
ES-2014-1726240,"Fellowes Shelving, Blue",0.1,260.00,5,Office Supplies
ES-2014-2039034,"Boston Canvas, Blue",0,161.00,3,Office Supplies
ES-2014-2039034,"Smead Lockers, Single Width",0.1,1250.00,7,Office Supplies
ES-2014-5373989,"Kraft Peel and Seal, Security-Tint",0,69.00,3,Office Supplies
ES-2014-1726240,"Motorola Audio Dock, with Caller ID",0,347.00,2,Technology
ES-2014-5373989,"Konica Calculator, Red",0.1,176.00,4,Technology
IT-2014-3571683,"Sauder Corner Shelving, Traditional",0.1,1061.00,8,Furniture
ES-2014-5928432,"SanDisk Cards & Envelopes, Premium",0.1,349.00,8,Office Supplies
ES-2014-3250104,"Advantus Clock, Ergonomic",0,100.00,2,Furniture
ES-2014-3250104,"Deflect-O Stacking Tray, Durable",0,126.00,5,Furniture
ES-2014-3250104,"Fellowes File Cart, Blue",0.1,371.00,3,Office Supplies
ES-2014-4032097,"Acco 3-Hole Punch, Economy",0,90.00,3,Office Supplies
ES-2014-4032097,"Acco Binder Covers, Durable",0,15.00,1,Office Supplies
ES-2014-4032097,"Avery Color Coded Labels, Adjustable",0,34.00,3,Office Supplies
ES-2014-4032097,"Smead Removable Labels, Adjustable",0,25.00,3,Office Supplies
ES-2014-4032097,"Smead Lockers, Wire Frame",0.1,1244.00,7,Office Supplies
ES-2014-3667834,"Kleencut Letter Opener, High Speed",0,53.00,2,Office Supplies
ES-2014-2677112,"Binney & Smith Markers, Blue",0.1,65.00,3,Office Supplies
ES-2014-2677112,"Ames Business Envelopes, Recycled",0.1,15.00,1,Office Supplies
ES-2014-5229497,"Acme Letter Opener, Steel",0,89.00,3,Office Supplies
ES-2014-4365132,"Hewlett Fax and Copier, Digital",0,578.00,3,Technology
ES-2014-5265060,"Sanford Pencil Sharpener, Easy-Erase",0,54.00,2,Office Supplies
ES-2014-5265060,"Brother Wireless Fax, Laser",0.15,644.00,2,Technology
ES-2014-2082412,"Ibico Binder Covers, Clear",0,39.00,3,Office Supplies
IT-2014-4717813,"GlobeWeis Manila Envelope, Recycled",0.5,26.00,2,Office Supplies
IT-2014-4717813,"Rogers Box, Industrial",0.5,24.00,2,Office Supplies
IT-2014-5989338,"Eldon Lockers, Blue",0.1,1603.00,9,Office Supplies
ES-2014-2658079,"Hon Chairmat, Set of Two",0.1,156.00,3,Furniture
ES-2014-2658079,"Smead Lockers, Industrial",0.1,537.00,3,Office Supplies
ES-2014-5977467,"Green Bar Memo Slips, 8.5 x 11",0,21.00,1,Office Supplies
IT-2014-1918237,"Canon Fax Machine, High-Speed",0.15,1076.00,4,Technology
ES-2014-3758334,"Sauder Classic Bookcase, Mobile",0.1,1579.00,4,Furniture
IT-2014-3417928,"Tenex File Cart, Blue",0.4,160.00,2,Office Supplies
ES-2014-1879971,"Enermax Numeric Keypad, Ergonomic",0,59.00,1,Technology
ES-2014-2785118,"SanDisk Computer Printout Paper, 8.5 x 11",0,170.00,5,Office Supplies
ES-2014-5297792,"Cameo Business Envelopes, Security-Tint",0,119.00,7,Office Supplies
ES-2014-5297792,"Enermax Note Cards, Premium",0,114.00,4,Office Supplies
ES-2014-5297792,"Fellowes Trays, Single Width",0.1,465.00,9,Office Supplies
IT-2014-5936992,"Ikea Stackable Bookrack, Mobile",0.6,200.00,4,Furniture
ES-2014-3811628,"Deflect-O Frame, Ergonomic",0,652.00,6,Furniture
ES-2014-3811628,"Deflect-O Light Bulb, Black",0,114.00,6,Furniture
IT-2014-5936992,"BIC Pencil Sharpener, Blue",0.5,44.00,3,Office Supplies
IT-2014-5936992,"OIC Paper Clips, Bulk Pack",0.5,7.00,1,Office Supplies
IT-2014-5936992,"Smead Removable Labels, 5000 Label Set",0.5,11.00,2,Office Supplies
IT-2014-5936992,"Enermax Memo Slips, Recycled",0.5,16.00,2,Office Supplies
ES-2014-3811628,"Xerox Note Cards, Premium",0,79.00,3,Office Supplies
ES-2014-3811628,"Fellowes Lockers, Blue",0.4,498.00,4,Office Supplies
ES-2014-5124272,"Tenex Shelving, Wire Frame",0,484.00,9,Office Supplies
ES-2014-5124272,"Belkin Keyboard, Programmable",0,598.00,7,Technology
ES-2014-1015287,"Safco Floating Shelf Set, Mobile",0,996.00,5,Furniture
ES-2014-1015287,"Hewlett Fax and Copier, Color",0,777.00,4,Technology
ES-2014-5640080,"Fiskars Box Cutter, High Speed",0,107.00,3,Office Supplies
ES-2014-1332952,"Stockwell Thumb Tacks, Bulk Pack",0,105.00,8,Office Supplies
ES-2014-2515763,"StarTech Inkjet, Wireless",0,302.00,1,Technology
ES-2014-3290145,"Logitech Keyboard, Ergonomic",0,211.00,3,Technology
ES-2014-1498386,"Ikea Corner Shelving, Metal",0,245.00,2,Furniture
IT-2014-2810229,"Dania Library with Doors, Metal",0,362.00,1,Furniture
ES-2014-1498386,"Fellowes Box, Industrial",0,60.00,3,Office Supplies
IT-2014-2810229,"Acco Hole Reinforcements, Clear",0,12.00,2,Office Supplies
IT-2014-2810229,"Smead Trays, Industrial",0.1,353.00,8,Office Supplies
