Order ID,Product Name,Discount,Sales,Quantity,Category
ES-2012-1743140,"Fiskars Shears, Steel",0,94.00,2,Office Supplies
ES-2012-3163464,"Cardinal 3-Hole Punch, Economy",0,144.00,5,Office Supplies
ES-2012-3163464,"Kraft Interoffice Envelope, Security-Tint",0,99.00,2,Office Supplies
ES-2012-5836794,"Avery Binding Machine, Clear",0,48.00,1,Office Supplies
ES-2012-5836794,"Smead Trays, Single Width",0.1,131.00,3,Office Supplies
ES-2012-1607446,"Ikea Floating Shelf Set, Mobile",0.1,467.00,3,Furniture
ES-2012-1607446,"HP Ink, High-Speed",0.15,431.00,4,Technology
ES-2012-1607446,"StarTech Printer, Red",0.15,646.00,3,Technology
ES-2012-1103132,"Elite Letter Opener, Easy Grip",0,145.00,5,Office Supplies
IT-2012-5541212,"Safco Library with Doors, Mobile",0.1,1765.00,5,Furniture
IT-2012-5541212,"KitchenAid Coffee Grinder, Red",0.1,190.00,3,Office Supplies
ES-2012-1838775,"Cardinal 3-Hole Punch, Clear",0,85.00,3,Office Supplies
IT-2012-1698939,"Advantus Door Stop, Duo Pack",0.3,158.00,5,Furniture
ES-2012-4848943,"Eldon File Cart, Single Width",0.1,345.00,3,Office Supplies
ES-2012-3846568,"Sharp Ink, Color",0.5,189.00,3,Technology
ES-2012-5853394,"Avery Index Tab, Economy",0,39.00,5,Office Supplies
ES-2012-1439705,"Sanford Pens, Fluorescent",0.1,22.00,2,Office Supplies
ES-2012-1439705,"Acco Binder, Clear",0.1,39.00,3,Office Supplies
ES-2012-1128541,"Stanley Pencil Sharpener, Water Color",0,112.00,4,Office Supplies
ES-2012-1128541,"Acco Binder, Recycled",0,124.00,8,Office Supplies
ES-2012-1128541,"Ames Peel and Seal, with clear poly window",0,89.00,4,Office Supplies
ES-2012-1128541,"Advantus Rubber Bands, Bulk Pack",0,17.00,1,Office Supplies
ES-2012-1128541,"Eldon Folders, Single Width",0.4,31.00,3,Office Supplies
ES-2012-3290357,"Hon Bag Chairs, Adjustable",0,333.00,7,Furniture
ES-2012-3290357,"Okidata Inkjet, Wireless",0,2199.00,7,Technology
ES-2012-4192199,"Stanley Markers, Easy-Erase",0,22.00,1,Office Supplies
ES-2012-4192199,"Smead Legal Exhibit Labels, Adjustable",0,27.00,3,Office Supplies
ES-2012-4904223,"Smead Box, Wire Frame",0.1,18.00,2,Office Supplies
ES-2012-4904223,"Apple Speaker Phone, Full Size",0,125.00,1,Technology
ES-2012-5455334,"Hon Chairmat, Red",0.1,150.00,3,Furniture
ES-2012-5455334,"Okidata Inkjet, White",0,623.00,2,Technology
ES-2012-5207465,"Smead Shelving, Single Width",0.1,88.00,2,Office Supplies
ES-2012-1191624,"Wilson Jones Index Tab, Economy",0,26.00,4,Office Supplies
ES-2012-1191624,"Fellowes File Cart, Blue",0.1,247.00,2,Office Supplies
ES-2012-5207465,"Konica Phone, Red",0.15,142.00,2,Technology
ES-2012-1191624,"Brother Copy Machine, Color",0.15,673.00,3,Technology
IT-2012-5085527,"Sanford Pencil Sharpener, Water Color",0.5,15.00,1,Office Supplies
ES-2012-3699074,"Nokia Office Telephone, VoIP",0,196.00,3,Technology
ES-2012-3241112,"Hon Executive Leather Armchair, Black",0.1,823.00,2,Furniture
ES-2012-3241112,"Fiskars Scissors, Steel",0.1,284.00,14,Office Supplies
ES-2012-3229508,"Wilson Jones 3-Hole Punch, Clear",0,82.00,3,Office Supplies
IT-2012-4642813,"Sanford Pencil Sharpener, Water Color",0.5,39.00,3,Office Supplies
ES-2012-1441306,"Stockwell Paper Clips, Bulk Pack",0,41.00,3,Office Supplies
ES-2012-1441306,"SanDisk Memory Card, Bluetooth",0,225.00,2,Technology
ES-2012-3471823,"Novimex Chairmat, Set of Two",0,293.00,5,Furniture
ES-2012-3471823,"Stanley Canvas, Easy-Erase",0,99.00,2,Office Supplies
ES-2012-1420387,"Kraft Business Envelopes, Set of 50",0,60.00,3,Office Supplies
ES-2012-3471823,"Motorola Office Telephone, VoIP",0,216.00,3,Technology
ES-2012-1420387,"Motorola Headset, Cordless",0.1,446.00,6,Technology
ES-2012-3944475,"SAFCO Rocking Chair, Adjustable",0.2,769.00,7,Furniture
ES-2012-3944475,"Eldon Clock, Duo Pack",0.1,153.00,3,Furniture
ES-2012-3944475,"Sanford Pens, Water Color",0.1,64.00,5,Office Supplies
ES-2012-3944475,"Avery Index Tab, Clear",0.1,16.00,3,Office Supplies
ES-2012-3944475,"Ibico Index Tab, Clear",0.1,56.00,7,Office Supplies
ES-2012-3944475,"Smead Folders, Wire Frame",0.2,53.00,4,Office Supplies
IT-2012-2013268,"Hon Round Labels, Laser Printer Compatible",0.5,3.00,1,Office Supplies
ES-2012-1211810,"Fellowes Lockers, Single Width",0.1,560.00,3,Office Supplies
ES-2012-3944475,"Brother Fax and Copier, Digital",0.1,344.00,2,Technology
IT-2012-1084413,"Hon Rocking Chair, Red",0.2,522.00,5,Furniture
ES-2012-2130247,"Ibico 3-Hole Punch, Economy",0,91.00,3,Office Supplies
ES-2012-2130247,"OIC Thumb Tacks, Assorted Sizes",0,35.00,3,Office Supplies
ES-2012-2130247,"Hon Shipping Labels, 5000 Label Set",0,24.00,2,Office Supplies
ES-2012-2130247,"Tenex File Cart, Single Width",0.4,241.00,3,Office Supplies
ES-2012-5923089,"Ikea 3-Shelf Cabinet, Traditional",0,712.00,5,Furniture
ES-2012-5923089,"Bevis Wood Table, Rectangular",0,1062.00,2,Furniture
ES-2012-5923089,"Binney & Smith Canvas, Fluorescent",0,158.00,3,Office Supplies
ES-2012-5923089,"SanDisk Mouse, Bluetooth",0,230.00,6,Technology
ES-2012-5923089,"Nokia Headset, Cordless",0,380.00,5,Technology
ES-2012-3420594,"Binney & Smith Pencil Sharpener, Water Color",0,269.00,9,Office Supplies
IT-2012-3490826,"Dania 3-Shelf Cabinet, Mobile",0.1,907.00,7,Furniture
ES-2012-4207693,"Acco Binder, Economy",0,30.00,2,Office Supplies
ES-2012-5359319,"Panasonic Inkjet, Durable",0.15,2123.00,8,Technology
ES-2012-4829315,"Advantus Rubber Bands, Bulk Pack",0,66.00,4,Office Supplies
ES-2012-4829315,"Smead Shelving, Blue",0,147.00,3,Office Supplies
ES-2012-3605781,"Ames Peel and Seal, Security-Tint",0.1,57.00,3,Office Supplies
ES-2012-3605781,"Stockwell Clamps, Assorted Sizes",0.1,29.00,2,Office Supplies
ES-2012-5411795,"Cuisinart Refrigerator, Red",0,1488.00,3,Office Supplies
ES-2012-5411795,"Cameo Clasp Envelope, Security-Tint",0,24.00,2,Office Supplies
ES-2012-5411795,"Tenex Box, Blue",0,99.00,6,Office Supplies
ES-2012-5823618,"BIC Pencil Sharpener, Fluorescent",0.1,27.00,1,Office Supplies
ES-2012-5823618,"GlobeWeis Peel and Seal, with clear poly window",0.1,45.00,2,Office Supplies
ES-2012-5823618,"Xerox Message Books, Premium",0.1,55.00,3,Office Supplies
ES-2012-1762599,"Sanford Markers, Easy-Erase",0,165.00,7,Office Supplies
ES-2012-1762599,"Stanley Sketch Pad, Fluorescent",0,46.00,1,Office Supplies
ES-2012-1762599,"Memorex Memory Card, Programmable",0,519.00,5,Technology
ES-2012-5345056,"Tenex Trays, Single Width",0.1,98.00,2,Office Supplies
ES-2012-5840484,"Tenex Photo Frame, Ergonomic",0,353.00,7,Furniture
ES-2012-5840484,"BIC Sketch Pad, Easy-Erase",0,343.00,7,Office Supplies
ES-2012-5264524,"Harbour Creations Steel Folding Chair, Red",0.1,352.00,4,Furniture
ES-2012-5677695,"Harbour Creations Chairmat, Red",0.1,518.00,8,Furniture
ES-2012-1211902,"Hamilton Beach Stove, Red",0.1,1952.00,4,Office Supplies
ES-2012-5264524,"Wilson Jones Binder Covers, Recycled",0,35.00,3,Office Supplies
ES-2012-5264524,"OIC Push Pins, Bulk Pack",0,15.00,1,Office Supplies
ES-2012-5264524,"Avery Legal Exhibit Labels, Laser Printer Compatible",0,23.00,2,Office Supplies
ES-2012-1956205,"Acco Binder, Durable",0,33.00,2,Office Supplies
ES-2012-5560916,"Office Star Rocking Chair, Adjustable",0.1,258.00,2,Furniture
ES-2012-5560916,"Eldon Clock, Duo Pack",0,226.00,4,Furniture
ES-2012-5560916,"Stiletto Letter Opener, Steel",0,75.00,3,Office Supplies
IT-2012-4099397,"Sanford Canvas, Blue",0.5,51.00,2,Office Supplies
ES-2012-5298422,"Cardinal Index Tab, Durable",0,15.00,2,Office Supplies
ES-2012-1091172,"Stockwell Paper Clips, Bulk Pack",0.5,14.00,2,Office Supplies
ES-2012-3075765,"Samsung Signal Booster, VoIP",0.1,246.00,2,Technology
ES-2012-3038461,"Eldon Frame, Durable",0,906.00,8,Furniture
ES-2012-3038461,"Boston Canvas, Water Color",0,398.00,7,Office Supplies
ES-2012-3038461,"Cardinal Binding Machine, Clear",0,345.00,7,Office Supplies
ES-2012-4635011,"Ibico Binder Covers, Durable",0,30.00,2,Office Supplies
ES-2012-4635011,"Acme Scissors, Serrated",0,66.00,3,Office Supplies
ES-2012-5575159,"Stockwell Staples, 12 Pack",0,20.00,2,Office Supplies
ES-2012-5575159,"Fellowes Folders, Wire Frame",0.1,46.00,2,Office Supplies
ES-2012-5575159,"Tenex Shelving, Wire Frame",0.1,242.00,5,Office Supplies
IT-2012-4853510,"Wilson Jones Binding Machine, Recycled",0.5,99.00,4,Office Supplies
IT-2012-4853510,"Hon Removable Labels, Adjustable",0.5,12.00,3,Office Supplies
IT-2012-4853510,"Fiskars Trimmer, Serrated",0.5,117.00,6,Office Supplies
ES-2012-5053715,"Acco Binding Machine, Durable",0,316.00,6,Office Supplies
ES-2012-5053715,"Hon Shipping Labels, 5000 Label Set",0,59.00,5,Office Supplies
ES-2012-5053715,"Smead Shipping Labels, 5000 Label Set",0,24.00,2,Office Supplies
ES-2012-5053715,"Rogers Shelving, Industrial",0,188.00,3,Office Supplies
ES-2012-5053715,"Acme Letter Opener, Serrated",0,54.00,2,Office Supplies
ES-2012-5053715,"Kleencut Ruler, Easy Grip",0,46.00,3,Office Supplies
ES-2012-5464624,"Okidata Inkjet, White",0,1245.00,4,Technology
ES-2012-1590672,"Acco 3-Hole Punch, Economy",0.1,54.00,2,Office Supplies
IT-2012-2197138,"Hewlett Fax Machine, Laser",0.15,816.00,3,Technology
ES-2012-1590672,"StarTech Inkjet, White",0.1,807.00,3,Technology
IT-2012-1478733,"Brother Wireless Fax, Digital",0,757.00,2,Technology
IT-2012-1478733,"Motorola Audio Dock, Cordless",0.4,211.00,2,Technology
IT-2012-1755975,"Harbour Creations Executive Leather Armchair, Black",0.1,426.00,1,Furniture
IT-2012-3839768,"GlobeWeis Manila Envelope, Security-Tint",0,89.00,3,Office Supplies
IT-2012-3839768,"Kraft Peel and Seal, Set of 50",0,41.00,2,Office Supplies
IT-2012-3839768,"Rogers Lockers, Wire Frame",0.1,758.00,4,Office Supplies
ES-2012-4572658,"Wilson Jones 3-Hole Punch, Durable",0.5,15.00,1,Office Supplies
ES-2012-4572658,"Kraft Clasp Envelope, Set of 50",0.5,5.00,1,Office Supplies
ES-2012-4572658,"Stockwell Push Pins, Metal",0.5,22.00,3,Office Supplies
ES-2012-3208808,"Harbour Creations Swivel Stool, Red",0.1,486.00,3,Furniture
ES-2012-3208808,"Avery Index Tab, Economy",0,16.00,2,Office Supplies
ES-2012-3208808,"Stockwell Push Pins, Metal",0,85.00,6,Office Supplies
ES-2012-3208808,"Samsung Headset, VoIP",0.15,187.00,3,Technology
ES-2012-3492146,"Sauder Stackable Bookrack, Traditional",0,293.00,2,Furniture
ES-2012-3492146,"Avery Binding Machine, Durable",0,50.00,1,Office Supplies
ES-2012-3492146,"Xerox Memo Slips, Multicolor",0,60.00,4,Office Supplies
IT-2012-2252852,"Tenex Shelving, Blue",0.1,98.00,2,Office Supplies
ES-2012-3800712,"Wilson Jones Hole Reinforcements, Durable",0,18.00,3,Office Supplies
ES-2012-3800712,"Stockwell Staples, Metal",0,44.00,4,Office Supplies
ES-2012-3802742,"BIC Highlighters, Blue",0.1,34.00,2,Office Supplies
ES-2012-3802742,"Enermax Router, USB",0.1,698.00,3,Technology
ES-2012-3802742,"Apple Headset, VoIP",0.1,330.00,5,Technology
ES-2012-3802742,"Apple Headset, with Caller ID",0.1,330.00,5,Technology
ES-2012-3451642,"Eldon Photo Frame, Ergonomic",0.5,142.00,5,Furniture
IT-2012-2549772,"SAFCO Bag Chairs, Red",0.1,44.00,1,Furniture
IT-2012-2549772,"Boston Sketch Pad, Water Color",0,259.00,5,Office Supplies
IT-2012-2549772,"Jiffy Business Envelopes, Set of 50",0,20.00,1,Office Supplies
IT-2012-2549772,"Smead Folders, Industrial",0.1,97.00,6,Office Supplies
IT-2012-2549772,"Tenex Lockers, Single Width",0.1,735.00,4,Office Supplies
ES-2012-1688414,"GlobeWeis Manila Envelope, Set of 50",0,82.00,3,Office Supplies
ES-2012-1688414,"Panasonic Printer, Wireless",0.15,680.00,3,Technology
ES-2012-1688414,"Apple Speaker Phone, Cordless",0.15,536.00,5,Technology
ES-2012-1439531,"KitchenAid Stove, Silver",0,1142.00,2,Office Supplies
ES-2012-1439531,"Kraft Mailers, Set of 50",0,113.00,3,Office Supplies
ES-2012-1439531,"Belkin Router, Ergonomic",0,1283.00,5,Technology
ES-2012-4621754,"Cisco Smart Phone, with Caller ID",0.1,2944.00,5,Technology
IT-2012-5367645,"Binney & Smith Sketch Pad, Easy-Erase",0,93.00,2,Office Supplies
IT-2012-5367645,"Fellowes File Cart, Single Width",0.4,412.00,5,Office Supplies
IT-2012-5367645,"Tenex Shelving, Blue",0.4,98.00,3,Office Supplies
ES-2012-2113350,"BIC Markers, Easy-Erase",0.1,96.00,4,Office Supplies
ES-2012-2113350,"Smead Lockers, Blue",0.1,1071.00,6,Office Supplies
ES-2012-5138595,"Green Bar Parchment Paper, Recycled",0,50.00,3,Office Supplies
ES-2012-5138595,"SanDisk Parchment Paper, Premium",0,33.00,2,Office Supplies
ES-2012-5138595,"Fellowes Folders, Blue",0.1,48.00,2,Office Supplies
ES-2012-5138595,"Rogers Trays, Blue",0.1,167.00,3,Office Supplies
ES-2012-5138595,"Smead Shelving, Wire Frame",0.1,130.00,3,Office Supplies
ES-2012-4730842,"Eldon Folders, Wire Frame",0,48.00,3,Office Supplies
ES-2012-3761154,"Elite Ruler, Easy Grip",0,46.00,3,Office Supplies
ES-2012-5805673,"GlobeWeis Business Envelopes, Set of 50",0.1,62.00,4,Office Supplies
ES-2012-5805673,"Accos Rubber Bands, Bulk Pack",0.1,30.00,2,Office Supplies
ES-2012-5805673,"Green Bar Note Cards, Multicolor",0.1,214.00,7,Office Supplies
IT-2012-5640548,"BIC Canvas, Easy-Erase",0.5,189.00,7,Office Supplies
IT-2012-5640548,"BIC Pens, Easy-Erase",0.5,22.00,3,Office Supplies
IT-2012-5640548,"Cardinal 3-Hole Punch, Clear",0.5,57.00,4,Office Supplies
IT-2012-5640548,"GlobeWeis Mailers, Recycled",0.5,37.00,2,Office Supplies
IT-2012-5640548,"Accos Push Pins, 12 Pack",0.5,14.00,2,Office Supplies
IT-2012-5640548,"Acme Trimmer, High Speed",0.5,67.00,3,Office Supplies
IT-2012-5640548,"Memorex Memory Card, USB",0.5,205.00,4,Technology
IT-2012-4580670,"Tenex Stacking Tray, Durable",0.3,53.00,3,Furniture
ES-2012-5760651,"Rogers File Cart, Single Width",0.1,255.00,2,Office Supplies
ES-2012-5760651,"Rogers Shelving, Blue",0.1,168.00,3,Office Supplies
ES-2012-5760651,"Elite Shears, Serrated",0,87.00,2,Office Supplies
ES-2012-5578260,"Epson Receipt Printer, Wireless",0.1,316.00,3,Technology
ES-2012-2390614,"Jiffy Business Envelopes, Recycled",0,44.00,3,Office Supplies
IT-2012-3387248,"Cardinal Binder Covers, Recycled",0.5,49.00,8,Office Supplies
ES-2012-1927421,"Tenex Clock, Ergonomic",0,147.00,3,Furniture
ES-2012-1927421,"Cardinal 3-Hole Punch, Economy",0,202.00,7,Office Supplies
ES-2012-1927421,"Rogers Lockers, Single Width",0.1,381.00,2,Office Supplies
ES-2012-1927421,"Memorex Memory Card, Bluetooth",0,307.00,3,Technology
ES-2012-3409639,"SAFCO Rocking Chair, Black",0.1,238.00,2,Furniture
IT-2012-2498718,"Office Star Steel Folding Chair, Black",0.1,402.00,5,Furniture
IT-2012-2498718,"Tenex File Cart, Single Width",0.1,242.00,2,Office Supplies
ES-2012-3778678,"Cardinal Binding Machine, Durable",0,154.00,3,Office Supplies
ES-2012-3778678,"Logitech Mouse, Ergonomic",0,108.00,4,Technology
ES-2012-3778678,"Motorola Smart Phone, Cordless",0.15,1639.00,3,Technology
ES-2012-4662036,"Advantus Clock, Duo Pack",0,257.00,5,Furniture
ES-2012-2633867,"Advantus Stacking Tray, Durable",0,132.00,5,Furniture
ES-2012-4662036,"Cuisinart Coffee Grinder, Red",0.1,104.00,3,Office Supplies
ES-2012-4662036,"Boston Markers, Easy-Erase",0,53.00,2,Office Supplies
ES-2012-4662036,"Stanley Highlighters, Fluorescent",0,32.00,2,Office Supplies
ES-2012-4662036,"Wilson Jones Hole Reinforcements, Economy",0,18.00,4,Office Supplies
ES-2012-4662036,"Jiffy Mailers, Security-Tint",0,119.00,3,Office Supplies
ES-2012-4662036,"Smead Shipping Labels, Laser Printer Compatible",0,46.00,4,Office Supplies
ES-2012-1369374,"Fellowes Folders, Blue",0.1,48.00,2,Office Supplies
ES-2012-1369374,"Fellowes Trays, Industrial",0.1,208.00,4,Office Supplies
ES-2012-4662036,"Smead Lockers, Single Width",0.1,179.00,1,Office Supplies
ES-2012-2633867,"Ibico Binder, Durable",0,34.00,2,Office Supplies
ES-2012-4662036,"Samsung Headset, Full Size",0,223.00,3,Technology
ES-2012-2633867,"SanDisk Mouse, Ergonomic",0,144.00,4,Technology
ES-2012-5113958,"Hoover Stove, Red",0,3979.00,7,Office Supplies
ES-2012-5113958,"Accos Push Pins, Bulk Pack",0,44.00,3,Office Supplies
ES-2012-5113958,"Canon Personal Copier, Laser",0,428.00,3,Technology
ES-2012-1207634,"Tenex Light Bulb, Durable",0,80.00,5,Furniture
ES-2012-4551093,"Sanford Canvas, Fluorescent",0.5,78.00,3,Office Supplies
ES-2012-4551093,"Elite Shears, Steel",0.5,116.00,5,Office Supplies
ES-2012-4913400,"Tenex Light Bulb, Ergonomic",0,193.00,11,Furniture
ES-2012-4913400,"Fellowes Lockers, Industrial",0.1,561.00,3,Office Supplies
ES-2012-4913400,"Nokia Smart Phone, Full Size",0.15,1622.00,3,Technology
IT-2012-5224735,"Wilson Jones Binder Covers, Clear",0.5,16.00,3,Office Supplies
ES-2012-2890249,"Wilson Jones Binder, Economy",0,26.00,2,Office Supplies
ES-2012-2890249,"Hon Legal Exhibit Labels, 5000 Label Set",0,68.00,6,Office Supplies
IT-2012-5224735,"Apple Headset, with Caller ID",0.5,73.00,2,Technology
ES-2012-2890249,"Enermax Flash Drive, Programmable",0,215.00,5,Technology
ES-2012-2224678,"Ikea Stackable Bookrack, Pine",0,372.00,3,Furniture
ES-2012-2224678,"Rubbermaid Photo Frame, Duo Pack",0,259.00,5,Furniture
ES-2012-1361094,"Tenex Photo Frame, Black",0,415.00,8,Furniture
ES-2012-4718408,"Smead File Cart, Industrial",0.5,321.00,5,Office Supplies
ES-2012-2224678,"KitchenAid Toaster, White",0,668.00,8,Office Supplies
ES-2012-2360362,"BIC Highlighters, Blue",0,38.00,2,Office Supplies
ES-2012-2360362,"Binney & Smith Pens, Easy-Erase",0,85.00,7,Office Supplies
ES-2012-2360362,"Boston Canvas, Water Color",0,170.00,3,Office Supplies
ES-2012-2360362,"Boston Pens, Blue",0,43.00,3,Office Supplies
ES-2012-1361094,"Breville Coffee Grinder, White",0,720.00,12,Office Supplies
ES-2012-1361094,"Ibico Binder, Durable",0,153.00,9,Office Supplies
ES-2012-1361094,"Wilson Jones Binding Machine, Durable",0,151.00,3,Office Supplies
ES-2012-1361094,"OIC Clamps, Bulk Pack",0,40.00,2,Office Supplies
ES-2012-4718408,"Logitech Flash Drive, Bluetooth",0.5,168.00,11,Technology
ES-2012-2224678,"HP Copy Machine, Color",0,1716.00,7,Technology
ES-2012-2123999,"Rubbermaid Light Bulb, Ergonomic",0,140.00,8,Furniture
ES-2012-2123999,"Cardinal Binder, Economy",0,28.00,2,Office Supplies
ES-2012-2123999,"Tenex Box, Blue",0.1,104.00,7,Office Supplies
ES-2012-2123999,"HP Personal Copier, Laser",0.15,423.00,4,Technology
ES-2012-2123999,"Samsung Signal Booster, Full Size",0.15,469.00,4,Technology
ES-2012-1258420,"Stanley Pens, Water Color",0,66.00,5,Office Supplies
ES-2012-4868521,"Tenex Lockers, Blue",0.1,184.00,1,Office Supplies
ES-2012-4406013,"Boston Markers, Blue",0,53.00,2,Office Supplies
IT-2012-5346950,"Novimex Swivel Stool, Adjustable",0.1,150.00,1,Furniture
IT-2012-5346950,"Ibico Binder, Recycled",0,79.00,5,Office Supplies
IT-2012-5346950,"Hon File Folder Labels, Laser Printer Compatible",0,17.00,2,Office Supplies
IT-2012-5346950,"Smead Box, Wire Frame",0.1,9.00,1,Office Supplies
IT-2012-5346950,"Smead File Cart, Single Width",0.1,462.00,4,Office Supplies
IT-2012-5346950,"Acme Box Cutter, High Speed",0,227.00,6,Office Supplies
ES-2012-4943358,"Acco Binder, Clear",0,15.00,1,Office Supplies
ES-2012-4943358,"Wilson Jones Binder Covers, Economy",0,45.00,4,Office Supplies
IT-2012-3605163,"Harbour Creations Executive Leather Armchair, Red",0.1,1285.00,3,Furniture
IT-2012-3605163,"Avery Color Coded Labels, Laser Printer Compatible",0,66.00,5,Office Supplies
IT-2012-3605163,"Rogers Lockers, Single Width",0.1,571.00,3,Office Supplies
IT-2012-3605163,"Tenex Folders, Blue",0.1,84.00,4,Office Supplies
IT-2012-4058325,"Smead Legal Exhibit Labels, 5000 Label Set",0,11.00,1,Office Supplies
IT-2012-4058325,"Apple Signal Booster, with Caller ID",0.1,984.00,8,Technology
IT-2012-3821825,"Stockwell Staples, Bulk Pack",0.5,16.00,3,Office Supplies
ES-2012-3761208,"Memorex Flash Drive, Programmable",0,155.00,5,Technology
ES-2012-3246286,"Deflect-O Clock, Ergonomic",0,49.00,1,Furniture
ES-2012-4896870,"Rubbermaid Light Bulb, Black",0,75.00,4,Furniture
ES-2012-3246286,"BIC Pencil Sharpener, Easy-Erase",0,29.00,1,Office Supplies
ES-2012-3246286,"Stockwell Clamps, Assorted Sizes",0,65.00,4,Office Supplies
ES-2012-3246286,"Harbour Creations Color Coded Labels, Alphabetical",0,38.00,3,Office Supplies
ES-2012-1885168,"Boston Pens, Blue",0,71.00,5,Office Supplies
ES-2012-1885168,"Tenex Trays, Blue",0.4,195.00,6,Office Supplies
ES-2012-4896870,"Green Bar Cards & Envelopes, 8.5 x 11",0,105.00,2,Office Supplies
ES-2012-3246286,"Logitech Numeric Keypad, Programmable",0,96.00,2,Technology
ES-2012-3246286,"Epson Printer, Red",0.15,221.00,1,Technology
ES-2012-3290540,"Konica Calculator, White",0,50.00,1,Technology
ES-2012-2468694,"Boston Highlighters, Easy-Erase",0,57.00,3,Office Supplies
ES-2012-2468694,"Acco Binder Covers, Durable",0,119.00,8,Office Supplies
ES-2012-2468694,"Enermax Keyboard, Ergonomic",0,406.00,5,Technology
ES-2012-2468694,"Logitech Memory Card, USB",0,207.00,2,Technology
ES-2012-3422940,"Stanley Highlighters, Blue",0,74.00,5,Office Supplies
ES-2012-3422940,"Acco Binder, Economy",0,45.00,3,Office Supplies
IT-2012-1052607,"Fiskars Trimmer, Serrated",0.5,39.00,2,Office Supplies
ES-2012-3217372,"Ames Manila Envelope, Security-Tint",0,108.00,4,Office Supplies
ES-2012-5202527,"Safco Classic Bookcase, Pine",0.1,791.00,2,Furniture
ES-2012-1771958,"Sauder Floating Shelf Set, Metal",0,582.00,3,Furniture
ES-2012-5202527,"Binney & Smith Sketch Pad, Water Color",0,99.00,2,Office Supplies
ES-2012-4047647,"Logitech Keyboard, Ergonomic",0,562.00,8,Technology
ES-2012-4487516,"Sanford Highlighters, Easy-Erase",0,48.00,3,Office Supplies
ES-2012-4487516,"Avery Binding Machine, Recycled",0,197.00,4,Office Supplies
ES-2012-4487516,"Kraft Clasp Envelope, with clear poly window",0,50.00,4,Office Supplies
ES-2012-2846766,"Binney & Smith Canvas, Fluorescent",0.1,142.00,3,Office Supplies
ES-2012-2846766,"Wilson Jones Binder Covers, Durable",0.1,69.00,6,Office Supplies
ES-2012-4818797,"Boston Sketch Pad, Blue",0,292.00,6,Office Supplies
ES-2012-4818797,"Stanley Pens, Fluorescent",0,34.00,3,Office Supplies
ES-2012-4818797,"Fellowes Trays, Blue",0.1,52.00,1,Office Supplies
ES-2012-4346320,"Enermax Message Books, 8.5 x 11",0,53.00,2,Office Supplies
ES-2012-4346320,"Acme Letter Opener, Steel",0,89.00,3,Office Supplies
ES-2012-4818797,"SanDisk Keyboard, USB",0,245.00,3,Technology
ES-2012-4818797,"Canon Fax and Copier, High-Speed",0.15,644.00,4,Technology
ES-2012-4430401,"Harbour Creations Shipping Labels, 5000 Label Set",0,107.00,9,Office Supplies
ES-2012-4991722,"HP Wireless Fax, Laser",0,1081.00,3,Technology
ES-2012-4657302,"Sanford Markers, Fluorescent",0,74.00,3,Office Supplies
ES-2012-1553743,"Apple Signal Booster, Cordless",0.15,119.00,1,Technology
ES-2012-1780035,"Cardinal Hole Reinforcements, Durable",0,14.00,2,Office Supplies
ES-2012-1176887,"Xerox Cards & Envelopes, Recycled",0,224.00,5,Office Supplies
ES-2012-4803808,"Boston Canvas, Water Color",0,170.00,3,Office Supplies
ES-2012-4141764,"OIC Staples, Bulk Pack",0,34.00,3,Office Supplies
ES-2012-4141764,"Avery Color Coded Labels, 5000 Label Set",0,96.00,7,Office Supplies
ES-2012-4803808,"SanDisk Router, Bluetooth",0,1282.00,5,Technology
ES-2012-4141764,"Sharp Fax and Copier, Laser",0,674.00,4,Technology
ES-2012-5112933,"Boston Sketch Pad, Easy-Erase",0,244.00,5,Office Supplies
ES-2012-1001818,"Smead Round Labels, Alphabetical",0.1,42.00,7,Office Supplies
ES-2012-3385452,"Fiskars Scissors, Serrated",0,60.00,3,Office Supplies
ES-2012-5859259,"Eaton Cards & Envelopes, Recycled",0.1,81.00,2,Office Supplies
ES-2012-5186485,"Bush Classic Bookcase, Pine",0,828.00,2,Furniture
ES-2012-4834117,"Cardinal 3-Hole Punch, Economy",0,86.00,3,Office Supplies
ES-2012-4834117,"Eaton Message Books, Premium",0,62.00,3,Office Supplies
ES-2012-5186485,"Cameo Mailers, Security-Tint",0,284.00,7,Office Supplies
ES-2012-5186485,"Smead File Cart, Single Width",0.4,541.00,7,Office Supplies
ES-2012-4834117,"Apple Signal Booster, Cordless",0.15,356.00,3,Technology
ES-2012-2662262,"Tenex Trays, Single Width",0,108.00,2,Office Supplies
ES-2012-1456782,"Wilson Jones Binder Covers, Clear",0,21.00,2,Office Supplies
ES-2012-4656254,"Tenex Folders, Single Width",0.1,63.00,3,Office Supplies
ES-2012-2431083,"GlobeWeis Manila Envelope, Recycled",0,79.00,3,Office Supplies
ES-2012-4099024,"Hamilton Beach Refrigerator, White",0.1,1345.00,3,Office Supplies
IT-2012-2737300,"Sanford Pencil Sharpener, Easy-Erase",0,190.00,7,Office Supplies
IT-2012-2737300,"Wilson Jones Binding Machine, Economy",0,245.00,5,Office Supplies
IT-2012-2737300,"Stiletto Shears, Steel",0,47.00,1,Office Supplies
ES-2012-4099024,"Memorex Keyboard, Ergonomic",0,69.00,1,Technology
IT-2012-2737300,"Cisco Audio Dock, VoIP",0,364.00,2,Technology
ES-2012-2826975,"Binney & Smith Markers, Water Color",0,191.00,7,Office Supplies
ES-2012-2826975,"Sanford Pencil Sharpener, Water Color",0,183.00,7,Office Supplies
ES-2012-2826975,"Cameo Peel and Seal, with clear poly window",0,49.00,2,Office Supplies
ES-2012-2826975,"Accos Paper Clips, Assorted Sizes",0,28.00,2,Office Supplies
IT-2012-4835449,"Novimex Bag Chairs, Adjustable",0,97.00,2,Furniture
IT-2012-4835449,"SanDisk Message Books, 8.5 x 11",0,140.00,5,Office Supplies
IT-2012-2825037,"Binney & Smith Sketch Pad, Blue",0,278.00,6,Office Supplies
IT-2012-2825037,"Novimex Round Labels, Laser Printer Compatible",0,6.00,1,Office Supplies
IT-2012-4835449,"Epson Card Printer, Durable",0,1361.00,8,Technology
IT-2012-2825037,"HP Wireless Fax, High-Speed",0,1075.00,3,Technology
ES-2012-3116842,"Avery File Folder Labels, Adjustable",0,35.00,5,Office Supplies
IT-2012-5123429,"Eldon Photo Frame, Durable",0.2,265.00,6,Furniture
IT-2012-5123429,"Hewlett Fax Machine, Digital",0.5,320.00,2,Technology
IT-2012-5123429,"Sharp Copy Machine, High-Speed",0.5,239.00,2,Technology
ES-2012-1556733,"Avery Binder, Recycled",0.5,7.00,1,Office Supplies
ES-2012-4124732,"Smead Trays, Industrial",0.1,132.00,3,Office Supplies
ES-2012-3874971,"Fiskars Box Cutter, High Speed",0,249.00,7,Office Supplies
ES-2012-4087601,"Deflect-O Photo Frame, Duo Pack",0,156.00,3,Furniture
ES-2012-4717022,"Hon Legal Exhibit Labels, Laser Printer Compatible",0,11.00,1,Office Supplies
ES-2012-4717022,"Novimex File Folder Labels, Adjustable",0,12.00,2,Office Supplies
ES-2012-4087601,"Fellowes Box, Wire Frame",0,56.00,3,Office Supplies
ES-2012-4087601,"Smead File Cart, Blue",0,382.00,3,Office Supplies
