Order ID,Product Name,Discount,Sales,Quantity,Category
ES-2013-2757712,"Smead Folders, Blue",0.1,31.00,2,Office Supplies
ES-2013-3540261,"Cardinal 3-Hole Punch, Recycled",0,87.00,3,Office Supplies
ES-2013-2757712,"Hewlett Wireless Fax, Laser",0,1901.00,5,Technology
ES-2013-2757712,"Cisco Smart Phone, Cordless",0,2606.00,4,Technology
ES-2013-1900042,"Cardinal Binder Covers, Clear",0,23.00,2,Office Supplies
IT-2013-4017525,"Hon Wood Table, Rectangular",0.35,1031.00,3,Furniture
IT-2013-2477436,"Tenex File Cart, Single Width",0.1,121.00,1,Office Supplies
ES-2013-5791015,"Logitech Memory Card, Ergonomic",0.5,304.00,6,Technology
IT-2013-3837703,"Eldon Clock, Durable",0.2,43.00,1,Furniture
ES-2013-3713989,"Xerox Memo Slips, Recycled",0,40.00,3,Office Supplies
IT-2013-3837703,"Smead Removable Labels, Laser Printer Compatible",0.5,15.00,3,Office Supplies
ES-2013-5311844,"Binney & Smith Canvas, Easy-Erase",0,207.00,4,Office Supplies
ES-2013-5311844,"Acco 3-Hole Punch, Economy",0,241.00,8,Office Supplies
ES-2013-5311844,"Memorex Mouse, USB",0,114.00,4,Technology
ES-2013-3496941,"Avery Binder Covers, Recycled",0,34.00,3,Office Supplies
ES-2013-1590572,"Enermax Keyboard, Bluetooth",0,250.00,3,Technology
ES-2013-3327575,"Eldon Folders, Single Width",0.4,20.00,2,Office Supplies
ES-2013-5014054,"Cameo Peel and Seal, with clear poly window",0,49.00,2,Office Supplies
IT-2013-5719417,"Bush Classic Bookcase, Mobile",0.1,374.00,1,Furniture
IT-2013-5719417,"Novimex Chairmat, Adjustable",0.1,106.00,2,Furniture
IT-2013-5719417,"Sanford Highlighters, Blue",0,63.00,4,Office Supplies
IT-2013-5719417,"Acco Index Tab, Durable",0,27.00,3,Office Supplies
IT-2013-5719417,"Cardinal Index Tab, Clear",0,27.00,4,Office Supplies
IT-2013-5719417,"Wilson Jones Binding Machine, Durable",0,101.00,2,Office Supplies
IT-2013-5719417,"Hewlett Personal Copier, Laser",0.15,736.00,6,Technology
IT-2013-5719417,"Panasonic Phone, White",0.15,212.00,3,Technology
ES-2013-1614127,"BIC Highlighters, Fluorescent",0,40.00,2,Office Supplies
ES-2013-1614127,"Rogers File Cart, Single Width",0.4,765.00,9,Office Supplies
ES-2013-1614127,"Memorex Flash Drive, Ergonomic",0,54.00,2,Technology
ES-2013-5847726,"Sauder Stackable Bookrack, Pine",0.6,239.00,4,Furniture
ES-2013-4513317,"BIC Sketch Pad, Fluorescent",0,349.00,7,Office Supplies
ES-2013-4513317,"Binney & Smith Pencil Sharpener, Easy-Erase",0,168.00,6,Office Supplies
ES-2013-4513317,"Sanford Sketch Pad, Water Color",0,97.00,2,Office Supplies
ES-2013-5113556,"Eldon Lockers, Industrial",0,397.00,2,Office Supplies
IT-2013-1992463,"Hewlett Fax Machine, High-Speed",0.1,573.00,2,Technology
ES-2013-5140487,"Dania Classic Bookcase, Mobile",0.1,1488.00,4,Furniture
ES-2013-1686888,"BIC Pencil Sharpener, Water Color",0,129.00,4,Office Supplies
ES-2013-1686888,"Panasonic Receipt Printer, Durable",0,484.00,4,Technology
ES-2013-1788644,"Boston Pencil Sharpener, Easy-Erase",0,181.00,6,Office Supplies
ES-2013-1788644,"Tenex Shelving, Wire Frame",0.1,97.00,2,Office Supplies
ES-2013-1788644,"Cisco Signal Booster, with Caller ID",0,1063.00,7,Technology
IT-2013-1049014,"Stanley Sketch Pad, Easy-Erase",0.5,112.00,5,Office Supplies
IT-2013-1049014,"Wilson Jones Binder Covers, Recycled",0.5,12.00,2,Office Supplies
ES-2013-4866061,"Kraft Interoffice Envelope, Recycled",0,229.00,5,Office Supplies
ES-2013-2966180,"Bevis Wood Table, Rectangular",0.35,1726.00,5,Furniture
ES-2013-3544260,"Office Star Chairmat, Adjustable",0,205.00,3,Furniture
ES-2013-2966180,"Binney & Smith Canvas, Blue",0,154.00,3,Office Supplies
ES-2013-2966180,"Cardinal 3-Hole Punch, Durable",0,61.00,2,Office Supplies
ES-2013-2966180,"Canon Fax and Copier, Color",0,578.00,3,Technology
ES-2013-2966180,"Hewlett Wireless Fax, Digital",0,1899.00,5,Technology
ES-2013-5331451,"Brother Personal Copier, Digital",0,143.00,1,Technology
ES-2013-1589316,"Boston Highlighters, Fluorescent",0,60.00,3,Office Supplies
ES-2013-1589316,"Tenex Box, Blue",0.1,45.00,3,Office Supplies
IT-2013-3003289,"Canon Copy Machine, Digital",0.5,393.00,3,Technology
ES-2013-3149063,"BIC Canvas, Blue",0,269.00,5,Office Supplies
ES-2013-3149063,"Boston Sketch Pad, Blue",0,194.00,4,Office Supplies
ES-2013-3971877,"Boston Canvas, Fluorescent",0,165.00,3,Office Supplies
ES-2013-3971877,"Avery Index Tab, Durable",0,20.00,3,Office Supplies
ES-2013-3149063,"Memorex Mouse, Bluetooth",0,85.00,3,Technology
ES-2013-3149063,"Cisco Headset, Full Size",0,628.00,7,Technology
IT-2013-5115273,"Bush 3-Shelf Cabinet, Traditional",0.1,129.00,1,Furniture
IT-2013-5115273,"Novimex Color Coded Labels, Adjustable",0,10.00,1,Office Supplies
IT-2013-5115273,"Smead Legal Exhibit Labels, Adjustable",0,9.00,1,Office Supplies
IT-2013-5115273,"Xerox Parchment Paper, Premium",0,40.00,3,Office Supplies
IT-2013-5115273,"Tenex Trays, Wire Frame",0.1,240.00,5,Office Supplies
ES-2013-5238037,"Sanford Pencil Sharpener, Fluorescent",0,207.00,8,Office Supplies
IT-2013-5115273,"Motorola Smart Phone, Full Size",0,2571.00,4,Technology
ES-2013-2639112,"Wilson Jones 3-Hole Punch, Durable",0,147.00,5,Office Supplies
ES-2013-4992865,"HP Wireless Fax, Color",0,1085.00,3,Technology
ES-2013-1827959,"Tenex Folders, Blue",0.1,84.00,4,Office Supplies
IT-2013-4649004,"Novimex Executive Leather Armchair, Red",0.5,920.00,4,Furniture
IT-2013-4649004,"GlobeWeis Business Envelopes, Set of 50",0.5,26.00,3,Office Supplies
IT-2013-4649004,"Smead Box, Blue",0.5,16.00,3,Office Supplies
IT-2013-4649004,"Belkin Keyboard, Programmable",0.5,299.00,7,Technology
IT-2013-2413489,"SanDisk Parchment Paper, Multicolor",0.5,54.00,6,Office Supplies
IT-2013-2413489,"Fiskars Scissors, Easy Grip",0.5,74.00,6,Office Supplies
ES-2013-2229883,"Cardinal Binding Machine, Economy",0.1,179.00,4,Office Supplies
ES-2013-2229883,"Ibico 3-Hole Punch, Recycled",0.1,55.00,2,Office Supplies
ES-2013-2229883,"Eldon Folders, Industrial",0.1,79.00,5,Office Supplies
ES-2013-2229883,"Nokia Signal Booster, VoIP",0.1,738.00,6,Technology
ES-2013-4662682,"Accos Rubber Bands, Metal",0.1,15.00,1,Office Supplies
ES-2013-4662682,"Eldon Trays, Single Width",0.2,77.00,2,Office Supplies
ES-2013-1209595,"GlobeWeis Peel and Seal, with clear poly window",0,75.00,3,Office Supplies
ES-2013-3005934,"Binney & Smith Pencil Sharpener, Water Color",0,135.00,5,Office Supplies
ES-2013-1209595,"Cisco Office Telephone, Full Size",0,409.00,5,Technology
ES-2013-3513264,"Ames Peel and Seal, Recycled",0,52.00,3,Office Supplies
ES-2013-3513264,"Canon Fax Machine, Digital",0,636.00,2,Technology
ES-2013-1827845,"Eldon Photo Frame, Duo Pack",0,116.00,2,Furniture
ES-2013-3650909,"Breville Refrigerator, Black",0,2594.00,5,Office Supplies
ES-2013-3650909,"Avery Binding Machine, Economy",0,342.00,7,Office Supplies
ES-2013-2680932,"StarTech Card Printer, White",0.1,437.00,3,Technology
ES-2013-5985266,"Eaton Memo Slips, Multicolor",0,106.00,7,Office Supplies
ES-2013-5538953,"Cameo Mailers, Recycled",0,259.00,7,Office Supplies
ES-2013-2235456,"Deflect-O Door Stop, Durable",0,123.00,3,Furniture
ES-2013-2235456,"Boston Pencil Sharpener, Water Color",0,193.00,6,Office Supplies
ES-2013-2591562,"BIC Markers, Fluorescent",0,166.00,6,Office Supplies
ES-2013-2591562,"BIC Pens, Easy-Erase",0,15.00,1,Office Supplies
IT-2013-4602742,"Wilson Jones Binding Machine, Durable",0,50.00,1,Office Supplies
IT-2013-4602742,"Xerox Note Cards, Multicolor",0,83.00,3,Office Supplies
IT-2013-4602742,"Rogers Shelving, Single Width",0.1,448.00,8,Office Supplies
IT-2013-4602742,"Samsung Smart Phone, VoIP",0.1,5726.00,10,Technology
IT-2013-5472233,"Advantus Light Bulb, Ergonomic",0.2,45.00,3,Furniture
IT-2013-5472233,"Tenex Light Bulb, Black",0.2,30.00,2,Furniture
IT-2013-1372622,"Harbour Creations Bag Chairs, Adjustable",0.5,96.00,3,Furniture
IT-2013-1372622,"Advantus Light Bulb, Black",0.6,24.00,3,Furniture
IT-2013-5472233,"Ibico Binding Machine, Recycled",0.5,259.00,10,Office Supplies
IT-2013-4063561,"Kraft Peel and Seal, Security-Tint",0,69.00,3,Office Supplies
IT-2013-1372622,"Avery Binding Machine, Durable",0.5,101.00,4,Office Supplies
IT-2013-1372622,"Cameo Peel and Seal, Recycled",0.5,30.00,3,Office Supplies
ES-2013-1925248,"HP Wireless Fax, Digital",0.15,2753.00,9,Technology
IT-2013-4063561,"Enermax Memory Card, Programmable",0,348.00,3,Technology
IT-2013-4063561,"Epson Inkjet, Durable",0,1533.00,5,Technology
IT-2013-1372622,"Enermax Memory Card, Ergonomic",0.5,224.00,4,Technology
IT-2013-1372622,"Motorola Office Telephone, VoIP",0.5,108.00,3,Technology
IT-2013-3642735,"Okidata Card Printer, Durable",0.15,598.00,4,Technology
IT-2013-1366976,"Dania 3-Shelf Cabinet, Pine",0.5,71.00,1,Furniture
IT-2013-1366976,"Xerox Note Cards, Recycled",0.5,39.00,3,Office Supplies
ES-2013-1424248,"Sanford Markers, Fluorescent",0,98.00,4,Office Supplies
ES-2013-2406661,"Boston Pens, Water Color",0,52.00,3,Office Supplies
ES-2013-5523206,"Cuisinart Blender, White",0,261.00,4,Office Supplies
ES-2013-5523206,"Okidata Receipt Printer, Durable",0,615.00,5,Technology
ES-2013-4971019,"Elite Letter Opener, High Speed",0,53.00,2,Office Supplies
ES-2013-3118043,"Avery 3-Hole Punch, Recycled",0,85.00,3,Office Supplies
IT-2013-1943902,"Hon Executive Leather Armchair, Red",0.2,735.00,2,Furniture
ES-2013-4487295,"Stanley Markers, Easy-Erase",0,45.00,2,Office Supplies
ES-2013-4487295,"GlobeWeis Clasp Envelope, with clear poly window",0,13.00,1,Office Supplies
ES-2013-4487295,"Fiskars Ruler, High Speed",0,29.00,2,Office Supplies
ES-2013-2440146,"Ibico Binder, Clear",0,45.00,3,Office Supplies
ES-2013-4550309,"BIC Pencil Sharpener, Fluorescent",0,212.00,7,Office Supplies
ES-2013-4550309,"Binney & Smith Markers, Fluorescent",0,76.00,3,Office Supplies
ES-2013-4562700,"Eldon Trays, Blue",0.1,173.00,4,Office Supplies
ES-2013-1253344,"Elite Scissors, Easy Grip",0,24.00,1,Office Supplies
ES-2013-4550309,"Logitech Numeric Keypad, Bluetooth",0,278.00,6,Technology
ES-2013-5746149,"Enermax Note Cards, Multicolor",0,98.00,3,Office Supplies
IT-2013-2634279,"Bevis Training Table, Adjustable Height",0.35,1096.00,5,Furniture
ES-2013-1649379,"Green Bar Note Cards, Multicolor",0,34.00,1,Office Supplies
ES-2013-2023938,"Eldon Door Stop, Black",0,602.00,12,Furniture
ES-2013-2023938,"Boston Sketch Pad, Fluorescent",0,648.00,13,Office Supplies
ES-2013-2023938,"Cardinal Binder Covers, Clear",0,34.00,3,Office Supplies
ES-2013-2023938,"Apple Speaker Phone, with Caller ID",0.15,734.00,7,Technology
ES-2013-3792525,"Harbour Creations Steel Folding Chair, Red",0.1,264.00,3,Furniture
ES-2013-3792525,"Tenex Light Bulb, Ergonomic",0,18.00,1,Furniture
ES-2013-3792525,"GlobeWeis Peel and Seal, Set of 50",0,43.00,2,Office Supplies
ES-2013-5365330,"Sanford Markers, Water Color",0,370.00,14,Office Supplies
ES-2013-2720611,"Novimex Chairmat, Red",0,225.00,4,Furniture
ES-2013-2720611,"Avery Legal Exhibit Labels, Laser Printer Compatible",0,11.00,1,Office Supplies
ES-2013-1460976,"Binney & Smith Pens, Easy-Erase",0.5,24.00,4,Office Supplies
ES-2013-3250735,"Binney & Smith Sketch Pad, Easy-Erase",0,186.00,4,Office Supplies
IT-2013-3695467,"Hoover Stove, White",0.5,3400.00,12,Office Supplies
ES-2013-3878132,"Hewlett Copy Machine, Laser",0,1580.00,6,Technology
ES-2013-5869536,"Xerox Message Books, Recycled",0,61.00,3,Office Supplies
ES-2013-4180822,"Boston Pens, Fluorescent",0,31.00,2,Office Supplies
ES-2013-4180822,"Canon Fax Machine, Digital",0,954.00,3,Technology
ES-2013-4998717,"Harbour Creations File Folder Labels, Laser Printer Compatible",0,70.00,8,Office Supplies
ES-2013-3062379,"Deflect-O Frame, Black",0.3,231.00,3,Furniture
ES-2013-3062379,"Binney & Smith Markers, Fluorescent",0,127.00,5,Office Supplies
ES-2013-3062379,"Acco Hole Reinforcements, Clear",0,12.00,2,Office Supplies
ES-2013-3062379,"Green Bar Parchment Paper, 8.5 x 11",0,104.00,5,Office Supplies
ES-2013-3346035,"Nokia Smart Phone, Cordless",0.15,1622.00,3,Technology
ES-2013-5863928,"Avery Binder Covers, Clear",0,63.00,6,Office Supplies
ES-2013-2335105,"Hon Bag Chairs, Set of Two",0.5,71.00,3,Furniture
IT-2013-2616134,"Advantus Light Bulb, Black",0.6,72.00,9,Furniture
ES-2013-2335105,"Avery 3-Hole Punch, Durable",0.5,88.00,6,Office Supplies
ES-2013-2335105,"Wilson Jones Binding Machine, Durable",0.5,126.00,5,Office Supplies
ES-2013-2335105,"GlobeWeis Manila Envelope, Set of 50",0.5,27.00,2,Office Supplies
IT-2013-2616134,"Harbour Creations Color Coded Labels, 5000 Label Set",0.5,20.00,3,Office Supplies
ES-2013-2335105,"Konica Card Printer, Wireless",0.5,613.00,7,Technology
ES-2013-4345105,"Dania Floating Shelf Set, Metal",0.1,152.00,1,Furniture
ES-2013-4345105,"Fellowes Box, Blue",0.1,124.00,7,Office Supplies
ES-2013-2991881,"Eldon Light Bulb, Black",0,50.00,2,Furniture
ES-2013-2991881,"Sanford Markers, Blue",0,93.00,4,Office Supplies
ES-2013-2991881,"Ames Interoffice Envelope, Recycled",0,132.00,3,Office Supplies
ES-2013-2015486,"Deflect-O Frame, Durable",0,214.00,2,Furniture
ES-2013-2015486,"BIC Markers, Blue",0,132.00,5,Office Supplies
ES-2013-2015486,"Boston Markers, Blue",0,79.00,3,Office Supplies
ES-2013-5256775,"Binney & Smith Highlighters, Fluorescent",0,36.00,2,Office Supplies
ES-2013-3756924,"Rubbermaid Photo Frame, Ergonomic",0,101.00,2,Furniture
ES-2013-3735964,"Green Bar Cards & Envelopes, 8.5 x 11",0,105.00,2,Office Supplies
ES-2013-2355379,"Avery Index Tab, Durable",0,33.00,5,Office Supplies
ES-2013-2355379,"Fiskars Scissors, High Speed",0,116.00,5,Office Supplies
ES-2013-2803740,"Binney & Smith Pens, Water Color",0,30.00,2,Office Supplies
ES-2013-2803740,"Avery Binder Covers, Clear",0,11.00,1,Office Supplies
IT-2013-2122563,"Cuisinart Coffee Grinder, White",0.1,165.00,5,Office Supplies
IT-2013-2122563,"Wilson Jones Binding Machine, Recycled",0,49.00,1,Office Supplies
IT-2013-2122563,"Stockwell Staples, Bulk Pack",0,31.00,3,Office Supplies
IT-2013-2122563,"Kleencut Ruler, Serrated",0,41.00,4,Office Supplies
IT-2013-1673718,"Sauder Library with Doors, Metal",0.5,581.00,3,Furniture
IT-2013-1673718,"Advantus Photo Frame, Durable",0.2,120.00,3,Furniture
IT-2013-1673718,"Tenex Photo Frame, Duo Pack",0.2,249.00,6,Furniture
ES-2013-2147462,"Hamilton Beach Refrigerator, Black",0.1,899.00,2,Office Supplies
IT-2013-1673718,"BIC Canvas, Fluorescent",0.5,137.00,5,Office Supplies
IT-2013-1673718,"Sanford Pens, Blue",0.5,11.00,2,Office Supplies
IT-2013-1673718,"Cardinal Binder Covers, Economy",0.5,12.00,2,Office Supplies
ES-2013-2732869,"Sanford Pens, Easy-Erase",0,34.00,3,Office Supplies
IT-2013-1673718,"Logitech Keyboard, Bluetooth",0.5,72.00,2,Technology
ES-2013-1964432,"Harbour Creations Chairmat, Black",0,278.00,4,Furniture
ES-2013-1964432,"Cameo Peel and Seal, with clear poly window",0,74.00,3,Office Supplies
ES-2013-1964432,"Cisco Signal Booster, Full Size",0,153.00,1,Technology
ES-2013-4255605,"BIC Pencil Sharpener, Fluorescent",0,242.00,8,Office Supplies
ES-2013-5819284,"Office Star Rocking Chair, Adjustable",0.1,1032.00,8,Furniture
ES-2013-5819284,"Rubbermaid Photo Frame, Ergonomic",0,151.00,3,Furniture
ES-2013-5819284,"Binney & Smith Sketch Pad, Blue",0,185.00,4,Office Supplies
ES-2013-2830979,"Binney & Smith Markers, Fluorescent",0,76.00,3,Office Supplies
IT-2013-3154646,"Tenex File Cart, Single Width",0.1,362.00,3,Office Supplies
ES-2013-2926991,"Acco Binder Covers, Durable",0,44.00,3,Office Supplies
ES-2013-2926991,"Wilson Jones 3-Hole Punch, Economy",0,84.00,3,Office Supplies
ES-2013-2926991,"Wilson Jones 3-Hole Punch, Economy",0,84.00,3,Office Supplies
ES-2013-2830979,"Belkin Mouse, Ergonomic",0,347.00,9,Technology
ES-2013-2926991,"Enermax Router, Programmable",0,2079.00,8,Technology
ES-2013-2926991,"Hewlett Wireless Fax, Laser",0,760.00,2,Technology
ES-2013-2759612,"Bush Stackable Bookrack, Traditional",0,369.00,3,Furniture
ES-2013-2759612,"Acco 3-Hole Punch, Recycled",0,213.00,7,Office Supplies
ES-2013-2759612,"Cameo Interoffice Envelope, Security-Tint",0,100.00,2,Office Supplies
ES-2013-2979822,"Binney & Smith Sketch Pad, Water Color",0.1,178.00,4,Office Supplies
ES-2013-2979822,"Epson Card Printer, Durable",0.1,1071.00,7,Technology
ES-2013-2979822,"Okidata Calculator, White",0.1,137.00,3,Technology
ES-2013-5135305,"Novimex Executive Leather Armchair, Red",0.1,1243.00,3,Furniture
ES-2013-5135305,"Fellowes Box, Blue",0.1,53.00,3,Office Supplies
ES-2013-5135305,"Logitech Router, Programmable",0,1244.00,5,Technology
ES-2013-2483088,"Wilson Jones Index Tab, Economy",0,58.00,9,Office Supplies
ES-2013-1603822,"Stanley Sketch Pad, Fluorescent",0,91.00,2,Office Supplies
ES-2013-2483088,"Belkin Numeric Keypad, Ergonomic",0,59.00,1,Technology
ES-2013-2483088,"Enermax Flash Drive, USB",0,334.00,8,Technology
ES-2013-3949378,"Nokia Headset, with Caller ID",0,292.00,4,Technology
ES-2013-1603822,"HP Fax Machine, Laser",0,1200.00,4,Technology
ES-2013-2491395,"Deflect-O Frame, Durable",0,428.00,4,Furniture
ES-2013-2491395,"Boston Pens, Easy-Erase",0,29.00,2,Office Supplies
ES-2013-2491395,"Ibico Binder, Durable",0,34.00,2,Office Supplies
ES-2013-2491395,"Eldon Trays, Blue",0,240.00,5,Office Supplies
IT-2013-1635889,"Fellowes Box, Single Width",0.1,53.00,3,Office Supplies
ES-2013-2491395,"StarTech Phone, Wireless",0,298.00,4,Technology
IT-2013-1635889,"Sharp Personal Copier, Digital",0,598.00,5,Technology
ES-2013-5002349,"Deflect-O Door Stop, Duo Pack",0,264.00,6,Furniture
ES-2013-5002349,"Boston Sketch Pad, Fluorescent",0,150.00,3,Office Supplies
IT-2013-1799384,"Fellowes Box, Blue",0.4,47.00,4,Office Supplies
ES-2013-3051016,"Advantus Rubber Bands, 12 Pack",0,48.00,3,Office Supplies
ES-2013-3093926,"Bush 3-Shelf Cabinet, Mobile",0.1,263.00,2,Furniture
ES-2013-3093926,"Stiletto Ruler, Steel",0,43.00,3,Office Supplies
ES-2013-5579249,"Belkin Memory Card, Programmable",0,582.00,5,Technology
ES-2013-4686025,"Advantus Photo Frame, Duo Pack",0,159.00,3,Furniture
ES-2013-4686025,"Stockwell Staples, Assorted Sizes",0,25.00,3,Office Supplies
ES-2013-4250728,"Canon Personal Copier, High-Speed",0.65,592.00,12,Technology
ES-2013-2374863,"Chromcraft Conference Table, with Bottom Storage",0,873.00,1,Furniture
ES-2013-2374863,"Stanley Pens, Blue",0,40.00,4,Office Supplies
ES-2013-2374863,"Cardinal Binder Covers, Economy",0,48.00,4,Office Supplies
ES-2013-1510295,"BIC Pens, Easy-Erase",0,102.00,7,Office Supplies
IT-2013-4744502,"Avery Binder, Clear",0.5,49.00,8,Office Supplies
IT-2013-4744502,"Cardinal Index Tab, Clear",0.5,7.00,2,Office Supplies
IT-2013-4744502,"Eaton Computer Printout Paper, Multicolor",0.5,14.00,1,Office Supplies
ES-2013-5176094,"BIC Sketch Pad, Water Color",0,52.00,1,Office Supplies
ES-2013-3712216,"BIC Sketch Pad, Fluorescent",0,100.00,2,Office Supplies
ES-2013-3712216,"Kleencut Box Cutter, Steel",0,136.00,4,Office Supplies
ES-2013-3712216,"Nokia Headset, with Caller ID",0.4,132.00,3,Technology
ES-2013-4145439,"Sauder Library with Doors, Pine",0,778.00,2,Furniture
ES-2013-4145439,"Lesro Round Table, Rectangular",0,899.00,2,Furniture
ES-2013-4145439,"Cardinal Index Tab, Clear",0,27.00,4,Office Supplies
ES-2013-2211839,"Dania Floating Shelf Set, Metal",0,506.00,3,Furniture
IT-2013-2332242,"Enermax Cards & Envelopes, 8.5 x 11",0.5,77.00,3,Office Supplies
IT-2013-2332242,"Elite Ruler, High Speed",0.5,76.00,11,Office Supplies
ES-2013-2211839,"Acco Index Tab, Clear",0,8.00,1,Office Supplies
ES-2013-2211839,"Epson Receipt Printer, Red",0,228.00,2,Technology
IT-2013-1127161,"Hewlett Ink, Color",0.15,383.00,3,Technology
ES-2013-3150546,"Fellowes Box, Wire Frame",0.1,51.00,3,Office Supplies
ES-2013-3150546,"Brother Fax and Copier, High-Speed",0.1,1536.00,9,Technology
ES-2013-1830556,"SAFCO Swivel Stool, Adjustable",0.2,409.00,3,Furniture
ES-2013-1830556,"Avery Hole Reinforcements, Durable",0.1,16.00,3,Office Supplies
IT-2013-2494049,"Smead Round Labels, Adjustable",0.5,5.00,2,Office Supplies
IT-2013-2494049,"Smead Trays, Single Width",0.5,49.00,2,Office Supplies
IT-2013-2494049,"HP Wireless Fax, High-Speed",0.5,896.00,5,Technology
IT-2013-1476473,"Ibico Hole Reinforcements, Clear",0,6.00,1,Office Supplies
IT-2013-1476473,"Hon Shipping Labels, Alphabetical",0,22.00,2,Office Supplies
ES-2013-4486046,"GlobeWeis Clasp Envelope, Recycled",0,26.00,3,Office Supplies
ES-2013-1250006,"Fellowes Trays, Single Width",0.4,69.00,2,Office Supplies
ES-2013-3667448,"Rubbermaid Clock, Duo Pack",0,251.00,5,Furniture
ES-2013-3667448,"Enermax Computer Printout Paper, Multicolor",0,149.00,5,Office Supplies
ES-2013-3667448,"Tenex File Cart, Single Width",0,269.00,2,Office Supplies
ES-2013-3667448,"Hewlett Wireless Fax, Laser",0,3422.00,9,Technology
ES-2013-3058408,"Boston Pencil Sharpener, Water Color",0,58.00,2,Office Supplies
ES-2013-3058408,"Green Bar Parchment Paper, Premium",0,33.00,2,Office Supplies
ES-2013-2573970,"Advantus Frame, Ergonomic",0,439.00,4,Furniture
ES-2013-2573970,"Rubbermaid Photo Frame, Durable",0,146.00,3,Furniture
ES-2013-2573970,"Avery Binder Covers, Economy",0,44.00,4,Office Supplies
ES-2013-2338251,"Fellowes Lockers, Industrial",0.4,623.00,5,Office Supplies
ES-2013-5254576,"Rubbermaid Clock, Durable",0.3,99.00,3,Furniture
ES-2013-5254576,"Cuisinart Microwave, Black",0,278.00,1,Office Supplies
ES-2013-5941455,"Eldon Door Stop, Ergonomic",0,98.00,2,Furniture
ES-2013-5941455,"Tenex Stacking Tray, Ergonomic",0,67.00,3,Furniture
ES-2013-1001647,"Dania Stackable Bookrack, Pine",0,492.00,4,Furniture
ES-2013-1001647,"Bevis Computer Table, Fully Assembled",0.5,989.00,4,Furniture
ES-2013-5941455,"OIC Thumb Tacks, 12 Pack",0,41.00,3,Office Supplies
IT-2013-1582139,"Sanford Pencil Sharpener, Water Color",0,29.00,1,Office Supplies
ES-2013-1001647,"Acco Binding Machine, Durable",0,158.00,3,Office Supplies
ES-2013-1001647,"Avery Index Tab, Clear",0,19.00,3,Office Supplies
ES-2013-1001647,"Cardinal 3-Hole Punch, Clear",0,85.00,3,Office Supplies
ES-2013-1001647,"Cardinal Binder, Economy",0,14.00,1,Office Supplies
ES-2013-1001647,"SanDisk Parchment Paper, Recycled",0,66.00,4,Office Supplies
ES-2013-1001647,"Stiletto Letter Opener, High Speed",0,111.00,4,Office Supplies
IT-2013-1582139,"Epson Card Printer, Durable",0.4,204.00,2,Technology
ES-2013-1001647,"StarTech Receipt Printer, Wireless",0.4,66.00,1,Technology
ES-2013-3061639,"Bush Classic Bookcase, Traditional",0,2476.00,6,Furniture
ES-2013-3061639,"Boston Pens, Easy-Erase",0,58.00,4,Office Supplies
IT-2013-3774709,"Harbour Creations Steel Folding Chair, Red",0.6,78.00,2,Furniture
ES-2013-5495371,"Tenex Clock, Ergonomic",0,244.00,5,Furniture
ES-2013-3551039,"Cardinal Binding Machine, Clear",0,98.00,2,Office Supplies
ES-2013-5495371,"Boston Markers, Fluorescent",0,83.00,3,Office Supplies
ES-2013-5495371,"Ibico Hole Reinforcements, Economy",0,28.00,4,Office Supplies
IT-2013-4712032,"Panasonic Printer, Red",0.15,448.00,2,Technology
ES-2013-4471792,"StarTech Card Printer, Red",0,321.00,2,Technology
IT-2013-4180226,"Harbour Creations Rocking Chair, Adjustable",0.1,404.00,3,Furniture
IT-2013-4180226,"Xerox Cards & Envelopes, 8.5 x 11",0,246.00,5,Office Supplies
IT-2013-4180226,"Fellowes Shelving, Blue",0.1,156.00,3,Office Supplies
IT-2013-4180226,"Okidata Card Printer, Durable",0.15,299.00,2,Technology
IT-2013-5450529,"GlobeWeis Clasp Envelope, Recycled",0.5,22.00,5,Office Supplies
IT-2013-5450529,"Eldon Lockers, Wire Frame",0.5,197.00,2,Office Supplies
ES-2013-1608190,"Safco Corner Shelving, Traditional",0,448.00,3,Furniture
ES-2013-1608190,"Advantus Light Bulb, Duo Pack",0,40.00,2,Furniture
ES-2013-1608190,"Cuisinart Refrigerator, Silver",0,1987.00,4,Office Supplies
ES-2013-1608190,"Boston Canvas, Fluorescent",0,165.00,3,Office Supplies
ES-2013-1608190,"Avery 3-Hole Punch, Durable",0,59.00,2,Office Supplies
ES-2013-1608190,"SanDisk Computer Printout Paper, Recycled",0,149.00,5,Office Supplies
ES-2013-1608190,"Smead Box, Wire Frame",0,49.00,5,Office Supplies
ES-2013-5755406,"Breville Microwave, Red",0,905.00,3,Office Supplies
ES-2013-5755406,"Boston Pencil Sharpener, Easy-Erase",0,91.00,3,Office Supplies
ES-2013-5755406,"Boston Sketch Pad, Blue",0,194.00,4,Office Supplies
ES-2013-5755406,"Sanford Pencil Sharpener, Water Color",0,116.00,4,Office Supplies
ES-2013-5755406,"Jiffy Manila Envelope, Security-Tint",0,57.00,2,Office Supplies
ES-2013-5755406,"Cisco Smart Phone, Cordless",0,1954.00,3,Technology
ES-2013-4786711,"Bevis Round Table, Adjustable Height",0.35,1691.00,5,Furniture
IT-2013-4047109,"Hamilton Beach Toaster, Red",0.1,104.00,2,Office Supplies
ES-2013-4786711,"BIC Sketch Pad, Water Color",0,415.00,8,Office Supplies
ES-2013-4786711,"Acco Binder, Clear",0,29.00,2,Office Supplies
ES-2013-4786711,"Xerox Message Books, Recycled",0,41.00,2,Office Supplies
IT-2013-4047109,"Logitech Router, Bluetooth",0,742.00,3,Technology
ES-2013-3426036,"Tenex Frame, Ergonomic",0,326.00,3,Furniture
ES-2013-3426036,"Advantus Thumb Tacks, Assorted Sizes",0,44.00,4,Office Supplies
ES-2013-1030020,"Acco Binding Machine, Economy",0,255.00,5,Office Supplies
ES-2013-1030020,"Canon Fax and Copier, Color",0,964.00,5,Technology
ES-2013-2509119,"Ikea Classic Bookcase, Traditional",0,1235.00,3,Furniture
ES-2013-2509119,"Cameo Clasp Envelope, Security-Tint",0,83.00,7,Office Supplies
ES-2013-2509119,"Advantus Staples, Metal",0,22.00,2,Office Supplies
ES-2013-2509119,"Eldon Lockers, Blue",0.4,475.00,4,Office Supplies
ES-2013-2509119,"Nokia Smart Phone, Full Size",0.4,765.00,2,Technology
ES-2013-2215507,"Binney & Smith Pens, Blue",0.1,86.00,8,Office Supplies
ES-2013-2215507,"Logitech Router, Programmable",0.1,672.00,3,Technology
ES-2013-2041470,"Safco Corner Shelving, Traditional",0.1,135.00,1,Furniture
ES-2013-2041470,"Hon Steel Folding Chair, Adjustable",0.1,680.00,9,Furniture
ES-2013-4184078,"Hoover Microwave, White",0,2147.00,7,Office Supplies
ES-2013-1299501,"Stockwell Rubber Bands, Metal",0,49.00,3,Office Supplies
ES-2013-1299501,"Panasonic Receipt Printer, White",0.15,304.00,3,Technology
ES-2013-5151389,"BIC Pencil Sharpener, Easy-Erase",0,88.00,3,Office Supplies
ES-2013-5151389,"Eaton Memo Slips, 8.5 x 11",0,18.00,1,Office Supplies
ES-2013-5600967,"Sharp Fax Machine, Laser",0,2070.00,7,Technology
